Company name,Country,Site address,Latitude,Longitude,Province,City
Proteins Australia Pty Ltd,Australia,"3260 Princes Hwy, Moruya NSW 2537, Australia",-35.9502,150.098,New South Wales,Moruya
BHP Impex Canada,Canada,"720 Kennedy Rd, Scarborough, ON M1K 2B7, Canada",43.729687,-79.267287,Ontario,Toronto
Abideen And Company,Pakistan,"14-B / 16-A, Deh Ibrahim Hyderi, Korangi Creek, Karachi, Pakistan",24.8278,67.20735,,Karachi
Mundo Branco S. A.,Argentina,Independencia y Nahuel Ruca - Vivorata - Buenos Aires,-34.61829,-58.38077,,
Australian Fishmeal Company,Australia,"Suite 503/227 Collins St, Melbourne VIC 3000, Australia",-37.8158,144.9663,Victoria,Melbourne
NuBlend Pty Ltd,Australia,"78 Freestone Point Rd, Triabunna TAS 7190, Australia
",-42.51835,147.92905,Tasmania,Triabunna
Huatai Pharma Inc,China,"No.  37, Section 6, North Chengdu Avenue, Guanghan City, Deyang, Sichuan Province, P.R. China.",30.9225,104.2489,Sichuan,Deyang
Comeau,Canada,"60 Saulnierville Rd, Saulnierville, NS B0W 2Z0, Canada",44.2618,-66.1335,Nova Scotia,Saulnierville
Akash Fishmeal & Fish Oil Private Limited,India,"67/10 & 66/6, Khavaneshwar Mandir Rd",15.925022,73.59071,Maharashtra,"Kelus, Vengurla, Sindhudurg, 416520"
CSF Proteins Pty Ltd,Australia,"1 Merino St, Laverton North VIC 3026, Australia",-37.823,144.8131,Victoria,Laverton North
Liaoyu Antarctic Krill Technology Development Co. Ltd.,China,"No.  188, Dalianwan Street, Ganjingzi District, Dalian City, Liaoning Province, P.R. China.",39.0278,121.7122,Liaoning,Dalian
"Fujian Evergreen Feed Co., Ltd.",China,"No. 527, Sunshine, Fengming Village, Dongyuan Town, Longhai District, Zhangzhou City, Fujian Province",24.37059,117.89607,Fujian,Zhangzhou
"Novosana(Taicang) Bio Feed Co., Ltd",China,"No. 9 Changzhou Road, Taicang City, Jiangsu, China",,,Jiangsu,Taicang
Exportadora PMT,Costa Rica,"WQM8+R65, San José Province, Brasil District, Costa Rica",9.9351,-84.2348,San José Province,Brasil District
ASK Andaman Ltd,Myanmar,"Myeik Industrial Zone,Myeik Taung Village, Myeik Township,Tanintharyi Region",12.45725,98.62166,,
Valofish,France,"172 Rue Pierre et Auguste Vaneeckhoet, 62480 Le Portel, France",50.722361,1.5849,Samsun,Samsun
DSM Nutritional Products Canada Inc.,Canada,"39 England Ave, Mulgrave, NS B0E 2G0, Canada",45.6178,-61.3954,Nova Scotia,Mulgrave
Abalıoğlu Balık İşleme,Turkey,"Yörükler, 09500 Çine/Aydın, Türkiye / Kocabaş Mah. Ankara Bulv. Abalı Çiftliği No:6 Honaz / DENİZLİ",27.9698189,37.6361879,"Aydın, Aegean Region",09500 Aydın
Iceberg-2 LLC.,Georgia,"7 4400 Larnaca St, Poti, Georgia",42.1668,41.6805,Samegrelo-Zemo Svaneti,Poti
Olvea Fish Oils,France,"110 Rte de Valmont, 76400 Fécamp, France",49.75636,0.394645,Normandy,Fecamp
San Arawa S.A.,Argentina,"Perito Francisco Moreno 2552, V9410KTN Ushuaia, Tierra del Fuego",-54.794587,-68.26695,,
Aller Aqua A/S,Denmark,"Allervej 130, 6070 Christiansfeld, Denmark",55.3578,9.52369,,Christiansfeld
Aksha Fish Meal & Oil Company,India,"Veraval Coastal Highway, Near Narvai Mataji Temple",21.48166,69.76295,Gujarat,"Gosa, Porbandar, 360576"
Sanford Limited trading as ENZAQ,New Zealand,"14 Bristol Street, Blenheim 7274, New Zealand",-41.52965,174.008752,Marlborough,Blenheim
Agustiner S.A.,Argentina,"Calle 1007, entre 1002 y 1004 - Puerto de Mar del Plata - Buenos Aires",-37.9784,-57.5903,Provincia de Buenos Aires,Mar del Plata
Coomarpes Ltda.,Argentina,Calle 1003 E/ 1004 y 1006 - Puerto de Mar del Plata - Buenos Aires,-38.0462,-57.5459,Provincia de Buenos Aires,Mar del Plata
Gihon- Laboratorios Químicos SRL,Argentina,"Calle 6 S/N, Mar del Plata, Provincia de Buenos Aires, Argentina",-38.0015,-57.6648,Provincia de Buenos Aires,Mar del Plata
Al Faizal Dry Fish,India,Prabhas Patan,20.8996,70.39363,Gujarat,"Somnath, Gir Somnath, 362268"
Calvo Conservas El Salvador SA de CV,El Salvador,"Calle Playitas, El Salvador",13.2855,-87.7957,,
IQI BV,United States of America,"3834 Duck Creek Dr Unit A, Stockton, CA 95215",37.935187,-121.22505,,Stockton
Aker Biomarine Manufacturing LLC,United States of America,4494 Campbell Road Houston Texas 77041,29.83724,-95.52722,"Texas County,
Missouri",Houston
WUDI HUAXIANG AQUACULTURE CO.，LTD.,China,No. 30 FULU STREET WUDI COUNTY SHANDONG CHINA,37.73057,117.633263,Shandong,Binzhou
"Wudi Deda Agriculture Co., Limited",China,"26 Gong Yuan Yi Hao Dong Yuan, Cheng Yang Qu, Qing Dao Shi, Shan Dong Sheng, China, 266109",36.2783,120.4027,Shandong,Qing Dao Shi
Bioceval GmbH & Co. KG.,Germany,"Neufelder Str. 44X, 27472 Cuxhaven, Germany",53.8567,8.7174,Niedersachsen,Cuxhaven
Henry Lamotte Oils GmbH,Germany,"Merkurstraße 47, 28197 Bremen, Germany",53.0906,8.7162,Bremen,Bremen
Brim,Iceland,"Hafnarbraut 2-4, 300 Akranes",64.3139,-22.08551,Akraneskaupstaður,Akranes
Brim,Iceland,"Hafnarbyggð 12, 690 Vopnafjörður",65.75525,-14.82537,Akraneskaupstaður,Akranes
Huaneng Bio-technology Co.Ltd,China,"3G2M+66 Xinhua Town, Bayannur, Linhe District, Bayannur, Inner Mongolia, China",41.0539,107.5325,Inner Mongolia,Bayannur
Zhoushan Sinomega Biotech Engineering Co. Ltd,China,"3XMX+RX Dinghai District, Zhoushan, Zhejiang, China",30.0846,121.9999,Zhe Jiang Sheng,Zhoushan
Fujian High Fortune Bio-Tech Corp,China,"China, Fu Jian Sheng, Fu Zhou Shi, Fu Qing Shi, 育才路18-1号 邮政编码: 350307",25.5975,119.3001,Fu Jian Sheng,Fu Zhou Shi
Isfelag,Iceland,"Eyrarvegur 12d, 680 Þórshöfn, Iceland",66.1973,-15.3381,Langanesbyggð,Þórshöfn
Loðnuvinnslan hf. (LVF),Iceland,"Hafnargata 1, 750 Fáskrúðsfjörður",64.92425,-13.9905,Eastern Region,750 Fáskrúðsfjörður
Harinas Patagonicas S.R.L,Argentina,"Nino Incorvay 976, U9120 Puerto Madryn, Chubut, Argentina",-42.7223,-65.0332,Chubut,Puerto Madryn
Huatai Pharma Inc,China,"Development Zone, Xiaohan Town, Deyang City, Sichuan Province, P.R. China",30.7142,104.1214,Sichuan,Deyang
AZROW GUINEE,Guinea,Préfecture de Coyah Quartier Gomboya,,,Kindia,030 Coyah
Nguyen Thi Sau Fish Meal Production Facility,Vietnam,"Ấp Bà Bài, Xã Vĩnh Tế, Vĩnh Tế, Châu Đốc, An Giang, Vietnam // M2HX+56 Chau Doc, An Giang, Vietnam",10.677791,105.048216,An Giang,Chau Doc
NovoSana (Taicang) Bio Feed Co. Ltd,China,"No.  9, Changzhou Road, Taicang Economic Development Zone.",31.3076,120.6295,Sichuan,Su Zhou
"Binzhou City Public Sen Industry And Trade Co., Ltd.",China,"GFMW+V2 Huimin County, Binzhou, Shandong, China",37.5361,117.4972,Shandong,Binzhou
"Qingdao Zhuosidaer International Trading Co., Ltd",China,"Huan Wan Lu, Shi Bei Qu, Qing Dao Shi, Shan Dong Sheng, China, 266042",36.1568,120.3607,Shandong,Qing Dao Shi
"Yutong Industrial Co., Limited",China,"China, Zhe Jiang Sheng, Shao Xing Shi, Zhu Ji Shi, 解放路303号 邮政编码: 311814",29.9216,120.3386,Zhe Jiang Sheng,Shao Xing Shi
"Qingdao Zhenchangshen Commercial And Trade Co., Ltd.",China,"Huan Wan Lu, Shi Bei Qu, Qing Dao Shi, Shan Dong Sheng, China, 266042",36.1568,120.3607,Shandong,Qing Dao Shi
Mien Tay Aquafeed Ltd Co.,Vietnam,"4 Pham Ngoc Thach St., Cai Khe Ward, Can Tho, Ninh Kieu, Vietnam",,,An Giang,Châu Phú District
"Pacific Bio Products, LLC",United States of America,"Warrenton, 1935 NW Warrenton Dr, Warrenton, OR 97146",46.194722,-123.935278,,Newport
Sao Mai Group,Vietnam,"8FMV+HH2, Bến phà Vàm Cống, QL80, Bình Thành, Lấp Vò, An Giang, Vietnam",10.33445,105.494383,An Giang,Lấp Vò
Encompass,United States of America,"2090 SE 12th Pl, Warrenton, OR 97146, USA",46.1525,-123.885833,An Giang,Warrenton
Síldaravinnslan hf (SVN),Iceland,Naustahvammur 67-69 740 Neskaupstaður,65.1397,-13.7366,Fjarðabyggð,Neskaupstadur
Amar Sterilised Fish Meal,India,Jawar Naka,21.64799,69.57801,Gujarat,"Javar Village, Porbandar, 360579"
Panfast Marketing (M) Sdn. Bhd.,Malaysia,"Penang Sciense Park,1102,Jalan Perindustrian Bukit Minyak 18,Taman Perindustrian Bukit Mintak,14100 Simpang Ampat, Penang, Malaysia",5.30072,100.45052,,#REF!
GOLD FIN INTERNATIONAL L.L.C,Oman,"P.O. BOX 2582, AZAIBAH 130 SULTANATE OF OMAN",19.444895,57.709888,Muscat,112 Azaibah
"Rongcheng Rixin Aquatic Products Co., Ltd.",China,"200 meters west of the intersection of Fuhai Road and Yongxing Road, Rongcheng City, Weihai City, Shandong Province",37.1808,122.4456,Shandong,Weihai
Scotia Garden Seafood,Canada,"105 Short Beach Rd, Yarmouth, NS B5A 4A9, Canada",43.9405,-66.1527,Nova Scotia,Yarmouth
Binh Minh Im-Export Joint Stock Company,Vietnam,"National Highway 91, An Thoi Hamlet, My Thoi Ward, Long Xuyen City, An Giang Province",105.465637,10.351,An Giang,Long Xuyen
Ambitious Fishmeal Product,India,"Station Rd, near Kanchan Hotel",17.00218,73.352068,Maharashtra,"Ratnagiri, Ratnagiri, 415639"
Bio-Marine Ingredients Ireland Ltd.,Ireland,"355P+HR Lough Egish Food Park, County Monaghan, Ireland",54.059,-6.8129,County Monaghan,Lough Egish Food Park
"Shandong Hongji Biology Technology Co., Ltd",China,"46JV+PV Chengyang District, Qingdao, Shandong, China",36.9481,122.3872,Shandong,Hezei
"Shandong Rongfeng Bio-Technology Development Co., Ltd",China,"46JV+PV Chengyang District, Qingdao, Shandong, China",36.0011,120.2389,Shandong,Qingdao
BioMar A/S,Denmark,"Mylius-Erichsensvej 35, 7330 Brande, Denmark",55.949,9.12761,,Brande
Rongcheng Blue Ocean Biotech,China,"No.  599 Yunxi Road, Dongwangmen Village, Rongcheng City, Weihai City, Shandong Province",36.8764,122.3597,Shandong,Weihai
"Kalajoen Jäähdyttämö Oy, käsittelylaitos",Finland,SAARELANTIE 5,64.280698,23.915906,"Keski-Pohjanmaa,
Western and Central Finland,
Western Finland,
Mainland Finland",69100 Kannus
"Wudi Fengtai Aquaculture Co., Ltd.",China,"46JV+PV Chengyang District, Qingdao, Shandong, China",36.0011,120.2389,Shandong,Qingdao
Lunar FPR Ltd,United Kingdom,"1 Ship St, Peterhead AB42 1DP, UK",57.5021,-1.7717,"Aberdeenshire,
Scotland",AB42 Peterhead
Marine Biotechnology Products Ltd,Mauritius,"Motorway M2,Riche Terre",-20.13847,57.514221,Pamplemousses District,Port Louis
Ananda Feed Factory,India,"4, Gollavanitippa, Seesali Rd",16.415218,81.457717,Andhra Pradesh,"Kotha Pusalamarru, 534294"
PT. Argopuro Berkat Indonesia,Indonesia,"Jl. Imam Bonjol No. 55, Tukangkayu, Kec. Banyuwangi, Kabupaten Banyuwangi, Jawa Timur 68411, Indonesia",-8.215,114.3766,,
"Qingzhou Ekato Commercial Co., Ltd.",China,"China, Yun Nan Sheng, Kun Ming Shi, Guan Du Qu, 站前路119号 邮政编码: 650200",25.0172,102.7242,Shandong,Weifang
Rongcheng Jinghai Dingqian Xingyang Fish Meal Factory,China,"Dingzhiqian Village, Renhe Town, Rongcheng City, Weihai City, Shandong Province",37.1808,122.4456,Shandong,Weihai
Matti Halme Oy,Finland,"Hirvitie 401, 25250 Märynummi",61.92411,25.748151,"Finland Proper,
South-Western Finland,
Southern Finland,
Mainland Finland",25500 Salo
Síldaravinnslan hf (SVN),Iceland,"Strandarvegur 1- 11, 710 Seyðisfjörður",65.2694,-13.9874,Fjarðabyggð,Neskaupstadur
"Baja Marine Foods,S.A.P.I. De C.V.",Mexico,"Calle Cinco Manzana 8,Lote 3,El Sauzal,C.P.22760",31.894718,-116.706565,Baja California,22850 Ensenada
Rongcheng Xingyang Fishmeal Factory,China,"Dingzhiqian Village, Renhe Town, Rongcheng City, Weihai City, Shandong Province",36.9481,122.3872,Shandong,Weihai
PT. Argopuro Berkat Indonesia,Indonesia,"JG29+4WJ, Krajan II, Wringinanom, Kec. Wringinanom, Kabupaten Gresik, Jawa Timur 61176, Indonesia",-7.4,112.5196,,
"California Bahías, S.A. De C.V.",Mexico,"Calle 1, Lote 6 y 7, Parque Industrial Fondeport El Sauzal de Rodríguez, C.P. 22760, Ensenada, Baja California",31.89976,-116.708626,Baja California,22850 Ensenada
Guaymas Protein Company SA de CV,Mexico,"Lote 3 y 4 Manzana H sin número, Colonia Parque Industrial Pesquero Rodolfo Sánchez Taboada, C.P. 85486, Guaymas, Sonora, México.",27.88309,-110.872404,Sonora,Guaymas
"Industrial Pesquera Heras, S.A. de C.V.",Mexico,"Calle Central Lote 2 Manzana H (14), Colonia Parque Industrial Rodolfo Sánchez Taboada, Guaymas, Sonora México.",19.37366,-99.20933,Sonora,Guaymas
Maz Industrial SA de CV,Mexico,"Estero de Urías sin número Interior C, Colonia Urías, C.P. 82099, Mazatlán, Sinaloa, México.",23.21033,-106.41886,Sinaloa,82000 Mazatlán
Shandong Qilong Group Co. Ltd.,China,"Wudi Encomic and Development Zone, Binzhou, Shandong, China",37.7292,117.6639,Shandong,Binzhou
"Pescaharina de Guaymas, S.A. de C.V.",Mexico,"Calle 1 Sur, Lote 5 Manzana H, sin número, Colonia Parque Industrial Pesquero Rodolfo Sánchez Taboada, C.P. 85486, Guaymas, Sonora, México.",27.91214,-110.89134,Sonora,Mexico
Auqi Marine Bio-Tech Co. Ltd.,China,"No.  54, Jinsanjiao East Road, Caqiao, Xueyan Town, Wujin District, Changzhou City, Jiangsu Province, P.R. China.",31.52,120.0139,Jiangsu,Changzhou
"Shandong Bohai Group Co., Ltd.",China,"No.  100, Kongquehe Sanlu, Jimo District, Qingdao City, Shandong Province",36.3881,120.4469,Shandong,Qingdao
Pestell Nutrition,Canada,"141 Hamilton Rd, New Hamburg, ON N3A 2H1, Canada",43.386,-80.6986,Ontario,New Hamburg
West Coast Reduction Ltd.,Canada,"West Coast Reduction Ltd.
900 Maughan Road
Nanaimo, British Columbia
V9X 1J2",49.14,-123.878,British Columbia,Nanaimo
West Coast Reduction Ltd.,Canada,"West Coast Reduction Ltd.
105 Commercial Drive North
Vancouver, British Columbia
V5L 4V7",49.2849,-123.0713,British Columbia,Nanaimo
Kenney & Ross Limited,Canada,6493 Shore Rd,43.58936,-65.432211,Port Saxon,Nova Scotia
Pelagia Aberdeen,United Kingdom,"Depot, Greenwell Pl, East, Aberdeen AB12 3AY, UK",57.127,-2.075,Scotland,AB12 Aberdeen
Pelagia Greenock,United Kingdom,"20 Drumfrochar Rd, Greenock PA15 4TS, UK",55.9411,-4.7565,"Inverclyde,
Scotland",PA15 Greenock
Pelagia Grimsby,United Kingdom,"5 Gilbey Rd, Grimsby DN31 2SL, UK",53.5801,-0.1018,Alaska,Grimsby
Pelagia Killybegs,Ireland,"36 Parkhead, Corporation, Killybegs, Co. Donegal, F94 RX74, Ireland",54.645,-8.4313,County Donegal,Killybegs
"Procesadora Mar De Ensenada, S. De R.L. De C.V.",Mexico,"Calle Bonardi 148, El Sauzal, C.P 22760",31.907215,-116.695024,Baja California,22850 Ensenada
Manarthon,Tunisia,Route de Benguerden KM. 20 4170 Zarzis,33.5022,11.1118,Muğla,Zarzis
"SERCONOMAR, S.A DE C.V.",Mexico,"Lote 3, Manzana B del Parque Industrial Pesquero, Rodolfo Sánchez Taboada",27.883906,-110.871404,Sonora,85486 Guaymas
"Selecta de Guaymas, S.A. de C.V.",Mexico,"Lote 1 Manzana A, sin número, Colonia Parque Industrial Pesquero Rodolfo Sánchez Tabuada, C.P. 85489, Guaymas, Sonora.",27.8861,-110.9008,Sonora,Guaymas
Sea Pride LLC,Oman,"Plot No 132, Sur Industrial EstatE, Muscat, Oman",,,Ash Sharqiyah,Balad Bani Bu Hassan
Omega Protein Inc.,United States of America,"5735 Elder Ferry Rd, Moss Point, MS 39563, USA",30.4228,-88.5156,California,Eureka
Omega Protein Inc.,United States of America,"9730 Andrew Road Abbeville, LA 70510",29.8219,-92.1333,Louisiana,Abbeville
"Omega Protein, Inc.",United States of America,"610 Menhaden Road Reedville, VA 22539",37.8286,-76.2772,,Reedville
Pacific Seafood,United States of America,"1 Commercial St, Eureka, CA 95501, USA",40.8042,-124.1748,Alaska,Sand Point
Sonac Kiel GmbH,Germany,Ottostraße 8,54.27345,10.15415,"Kiel,
Schleswig-Holstein",24145 Kiel
Skinney-Þinganes,Iceland,"6RX2+V7G, Krosseyjarvegur, 780 Höfn í Hornafirði, Iceland / Miðósi 17",64.2499,-15.199,Sveitarfélagið Hornafjörður,Höfn í Hornafirði
Anhui Xinzhou Marine Biological Products Co. Ltd.,China,"Industrial Park, Daliang Village, Meicun Town, Langxi County, Xuancheng City, Anhui Province, P.R. China.",29.9142,116.495,Anhui,Xuancheng
Sonac Mering GmbH,Germany,Lechfeldstraße 2,48.269063,10.951768,"Landkreis Aichach-Friedberg,
Swabia,
Bavaria",86415 Mering
Aroma (N.Z.) Limited,New Zealand,"12 Senior Place, Bromley",-43.529764,172.693768,"Christchurch City,
Canterbury",8011 Christchurch
"Binzhou Shengying Aquaculture Co., Ltd. (BSY) / BINZHOU CITY SHENGYING AQUATIC PRODUCTS CO., LTD",China,"380 meters east of Liangcai Health Center, Yellow River Seventh Road, Bincheng District, Binzhou City, Shandong Province, P.R. China.",37.4275,118.0233,Shandong,Binzhou
Ocean Aquatic Proteins,Oman,"HGC8+852, Dawanji, Oman",24.570255,56.515935,,#REF!
Mowi Nutrition Goleniów Spolka z o.o.,Poland,"Boczna 14, 72-100 Łozienica, Poland",53.5299,14.7939,Województwo zachodniopomorskie,Łozienica
VSV,Iceland,"Strandvegur 82, 900 Vestmannaeyjabær, Iceland",63.444,-20.277,Vestmannaeyjabær,Vestmannaeyjabær
Manar Thon- Fishmeal,Tunisia,"G3VJ+64V, Dhouiher, Tunisia",33.543182,11.080314,Médenine,Zarzis
Eskja,Iceland,"Strandgata 2, 735 Eskifjörður",65.07576,-14.03014,Eastern Region,735 Eskifjörður
Fóðurverksmiðjan Laxá hf,Iceland,Krossanesi 2,65.7028,-18.1158,Northeastern Region,Akureyri
Trident Seafoods Corporation,United States of America,"46M6+26 Akutan, AK, USA",54.132222,-165.789167,Oregon,Warrenton
Trident Seafoods Corporation,United States of America,"73 Trident Way, Akutan, AK 99553",55.3354,-160.5024,Oregon,Warrenton
Ísfélag Vestmannaeyja hf,Iceland,"Tangagata, 900 Vestmannaeyjabær, Iceland",63.4429093,-20.27074731,Southern Region,Vestmannaeyjar
Ísfélag Vestmannaeyja hf,Iceland,,,,Southern Region,Vestmannaeyjar
"UniSea, Inc.",United States of America,"88 Salmon Way Dutch Harbor, AK 99692",53.88,-166.551944,Đồng Nai,Dutch Harbor
LYSI hf,Iceland,"Fiskislóð 5-9, 101 Reykjavík",64.155448,-21.953711,,Reykjavik
"Trident Seafoods Corporation (Sand Point, AK Shore Plant)",United States of America,"229 Main Street, Sand Point, AK 99661",55.33538,-160.50241,,Sand Point
"Westward Seafoods, Inc.",United States of America,"1 Mile Captain's Bay Rd., P.O. Box 920608 Dutch Harbor, AK 99692",53.871111,-166.543611,,Dutch Harbor/Unalaska (evidently pronounced Uhn rather than Yune)
Daybrook Fisheries Inc.,United States of America,"136 Daybrook Lane Empire, LA 70050",29.3819,-89.5931,Alaska,Empire
Icicle Seafoods Corporation Northern Victor (shore plant),United States of America,"1 Cannery Row, Egegik, AK 99579",-157.37599,58.21529,,Seattle
Icicle Seafoods Corporation Northern Victor (shore plant),United States of America,"88 Salmon Way, Unalaska, AK 99692
",-166.55212,53.880265,,Seattle
"Daybrook Fisheries, Inc.",United States of America,Empire,-89.5933416,29.3819741,"Plaquemines Parish,
Louisiana",Empire
Kodiak Fishmeal Company,United States of America,"915 Gibson Cove Rd, Kodiak, AK 99615; QHH3+QW Kodiak, Alaska",57.77941,-152.445217,"Kodiak Island,
Alaska",Kodiak
Aung Myat Phyo Int'l Fish Meal Plant,Myanmar,"Pa Htaw Kyaye Ywar, Kyun Su Township, Tanintheryi Region.",12.47187,98.453528,,#REF!
Anfal Marine Products,India,"Beside Mudga Fishing Harbour, Port Rd",14.74767,74.229623,Karnataka,"Mudga Post, Amdalli Gram, Uttara Kannada, 581324"
Triada Foods S.A.C.,Peru,"Av. Los Pescadores Mz. A, Lt. 1A-02, Zona Industrial 27 De Octubre",-9.0561,-78.5767,Áncash,Chimbote
"Taiwan Hung Kuo Industrial Co., Ltd.",Taiwan,"No.  7 Te Hsing 7th Rd., Su-Ao, I-Lan, Taiwan, R.O.C",24.63496512,121.8289623,"Yilan County,
Taiwan Province",Suao Township
RENETA SIA,Latvia,"Rīgas - Liepājas šoseja 101C, Saldus pagasts, Saldus novads, LV-3862",56.681901,22.45224,"Saldus novads,
Courland",LV-3801 Saldus
Nacionālās Zvejniecības Ražotāju Organizācija,Latvia,"""Dīriņi"", Blāzma, Puzes pagasts, Ventspils novads",56.981265,24.118054,"Ventspils novads,
Courland",Blāzma
Biovast,Latvia,"BIOVAST Saldus SIA RENETA 101C Rigas-Liepajas highway, Saldus municipality, Saldus parish, LV-3862, Latvia",56.6634,22.4926,Saldus novads,Saldus
Maruha (NZ) Corporation Limited on contract to Sealord Group Limited,New Zealand,"149 Vickerman Street, Port Nelson, Nelson 7010, New Zealand; P7VH+6R Nelson, New Zealand",-41.256534,173.279784,South Island,Nelson
Kalifeks,Latvia,"Akācijas iela 72, Pārolaine, Olaines pagasts, Olaines novads, LV-2127, Latvia",56.785833,23.957778,Olaines novads,Pārolaine
Valofish,Tunisia,Sidi El Heni,35.68042,10.324227,Samsun,Samsun
"Alyeska Seafoods, Inc.",United States of America,"551 W. Broadway Unalaska, AK 99685",53.87815612,-166.5399197,,Unalaska
PT. Argopuro Berkat Indonesia,Indonesia,"P777+Q2 Bareng, Banyuwangi Regency, East Java, Indonesia",-8.2856,114.2626,,
Pacific Bio Products,United States of America,"1935 NW Warrenton Dr.
Warrenton, OR 97146; ",46.1951149,-123.9350673,"Clatsop County,
Oregon",Warrenton
"Pacific Bio Products, LLC",United States of America,"1310 SE Bay Blvd Newport, OR 97365",44.62692839,-124.0356299,,Newport
Ocean Protein Llc,United States of America,"518 22nd St, Hoquiam, WA 98550",46.97397261,-123.8738322,"Grays Harbor County,
Washington",Hoquiam
A&R Nutricao Animal,Brazil,"CP54+V2, Cafelândia - State of Paraná, 85410-000, Brazil",-24.5886,-53.2962,Paraná,Nova Aurora
A&R Nutricao Animal,Brazil,"Av. Ver. João Batista Sanches, 371 - Parque Industrial, Maringá - PR, 87065-130, Brazil",-23.4541,-51.9991,Paraná,Nova Aurora
Kurzeme Fisheries Producers Organization,Latvia,"Jaunlatvieši, Jaunlatvieši, Ārlavas pagasts, Talsu novads, LV-3260, Latvia",57.3465,22.6434,Talsu novads,Jaunlatvieši
Empresa Pesquera Gamma S.A.,Peru,Av. Pascual Corcino N° 126,-9.09714219,-78.56350733,Áncash,Chimbote
Trident Seafoods Corporation,United States of America,"391 Alaska Peninsula Hwy, Naknek, AK 99633, USA",58.7287,-157.0088,Oregon,Warrenton
UAB Nord Baltic Fishery Group,Latvia,"Kārkliņi, Kārkliņi, Ķekava, Ķekavas pagasts, Ķekavas novads, LV-2123, Latvia",56.801944,24.268056,Ķekavas novads,Ķekava
(Quirola),Ecuador,kl 1.5 vía Arenillas- Chacras,-3.5481833,-80.19265,,
Air Buana,Indonesia,"Jl. Tratas No. 11, Dusun Curah, Tambakrejo, Kec. Muncar, Kabupaten Banyuwangi, Jawa Timur 68472, Indonesia",-8.4494,114.34665,,
Dhofar Fisheries & Food Industries Company SAOG,Oman,"Raysut Industrial Area, Road No.  3, Block A/2, PC: 211, Salalah, Oman",16.9727,53.9825,Dhofar Governorate,Raysut
"Venta FM, SIA",Latvia,"XHPC+4CV Alsunga, Alsungas pagasts, Kuldīga Municipality, Latvia
",56.98534185,21.57086287,Kuldīgas novads,Venta
PhilBest Canning Corporation,Philippines,"Talisay, Tambler General Santos City, 346V+X7P, General Santos City, South Cotabato, Philippines",6.0632,125.1438,Region XII,General Santos City
Liaoyu Antarctic Krill Technology Development Co. Ltd.,China,"No.  8-147, Dalianwan, Ganjingzi District, Dalian City, Liaoning Province, P.R. China",,,Liaoning,Dalian
CFG Investment S.A.C.,Peru,"Pasaje Santa Martha N° 704, Zona Industrial 27 De Octubre",-9.104760384,-78.56350516,Áncash,Chimbote
Luhua Biomarine (Shandong) Co. Ltd.,China,"No.  12, Zheng'an North Road, Jibei Development Zone, Jiyang Street, Jiyang District, Jinan, Shandong Province.",37.1186,117.2675,Shandong,Jinan
Arbee Aquatic Proteins Pvt Ltd,India,"AP-II/723, Aroor Industrial Area",9.884354,76.296174,Kerala,"Aroor, Cherthala, Alleppey, 688534"
Arbee Biomarine Extracts Private Limited,India,"Plot No. 13/P2, Thandya Industrial Area",12.158542,76.687173,Karnataka,"Nanjangud, Mysore, 570302"
General Tuna Corporation,Philippines,"XWFP+WHR, Zamboanga, Zamboanga Sibugay, Philippines",6.9747,121.936,Zamboanga Peninsula,Zamboanga
CFG Investment S.A.C.,Peru,Altura Del Km 754 De La Panamericana Sur,-16.61254,-72.70633,Áncash,Chimbote
Mega Fishing Corporation,Philippines,"2506 1, Santo Tomas, 4234 Batangas, Philippines",14.11262026,121.1437513,Batangas,Batangas
Havsbrun,Faroe Islands,"48 Bakkavegur, Fuglafjørður 530, Faroe Islands",62.2389,-6.8035,Eysturoy,Fuglafjørður
Atlantic Marine Products Private Limited,India,"Survey No.  224/1, plot No. 3",20.88165,71.37804,Gujarat,"Jafrabad, Amreli, 365540"
Alliance Select Foods International Inc.,Philippines,"24RR+HHJ, Purok Saydala, Makar - Siguel Rd, Lungsod ng General Santos, 9500 Timog Cotabato, Philippines",6.041481258,125.141374,,General Santos City
CFG Investment S.A.C.,Peru,"Lt. Acumulado A-D, Pasaje Com⁄N N° 180, Zona Industrial 27 De Octubre",-9.1126,-78.562,Áncash,Chimbote
Pesquera Capricornio S.A.,Peru,"Av. Enrique Meiggs N° 1798, Miramar Bajo",-9.0893,-78.5735,Áncash,Chimbote
Pesquera Jada S.A.,Peru,"Mz. B, Lt. 4 Y 5 Zona Industrial Gran Trapecio",-9.1078,-78.5617,Áncash,Chimbote
Corporacion Industrial Milagros Del Mar S.A.,Peru,"Carretera Panamericana Norte Km. 441, Sector La Primavera, Huamanchacate",-9.056,-78.577,Áncash,Chimbote
Beltran Peru E.I.R.L.,Peru,"Av. Brea Y Pari, As N° 151, Zona Ind. Gran Trapecio",-9.056,-78.577,Áncash,Chimbote
Pesquera Capricornio S.A.,Peru,"Av. Prolongación Centenario N° 2620-2628, Zona Los Ferroles",-11.9984,-77.1333,Áncash,Chimbote
Bransomar S.A.C.,Peru,"Av Los Pescadores N° 1200, Zona Industrial 27 De Octubre",-9.1139,-78.5438,Áncash,Chimbote
CFG INVESTMENT S.A.C.,Peru,Av. La Marina N° 370,-10.79290108,-77.74403446,Áncash,Chimbote
Shandong Kangjing Marine Bioengineering Co. Ltd.,China,"Near Provincial Highway 219, Gaomi City, Weifang, Shandong Province",119.9717,36.4731,Shandong,Weifang
Syarikat Kilang Serbok Ikan (Asia) Sdn. Bhd.,Malaysia,"(Factory): Kampung Sematang Pinang, 06600 Kuala Kedah, Kedah.
No. 47, Susuran Tuanku Haminah, Pusat Perdagangan Tuanku Haminah Mergong, Alor Setar, Kedah.",100.30881,6.09457,,#REF!
ALIMENTSA S.A.,Ecuador,"Aparnor - Alborada 5, Km 6., Av Isidro Ayora, Durán 090508, Ecuador",-2.200515724,-79.81358169,Guayas,Durán
FF Skagen A/S,Denmark,"Havnevagtvej 5, 9990 Skagen, Denmark",10.5981,57.7215,Skagen,Skagen
Cantarana S.A.C,Peru,"Calle 3 Mz. A, Lt.s N° 1A, 3, 6, 13, 5A, 5B, De La Zona Industrial Gran Trapecio",-9.108662,-78.564501,Áncash,Chimbote
BALANCEADOS NOVA S.A. BALNOVA,Ecuador,"Vía a la Costa, Guayaquil, Ecuador",-2.1871,-80.019,Guayas,Guayaquil
Avanti Feeds Ltd,India,"Balda vav faliya, Kumbhariya",20.5092318,72.9793537,Gujarat,"Balda, Killa-pardi, 396125"
Thai Union Marine Nutrients GmbH,Germany,"Hansestraße 12a, 18182 Bentwisch, Germany, 459H+62 Bentwisch, Germany",12.177582,54.118066,Rostock,Bentwisch
Aquatic Food Manufacturing Corporation,Philippines,"XX44+6MJ, Zamboanga, Zamboanga del Sur, Philippines",6.955575112,121.9566143,Zamboanga Peninsula,Zamboanga
