Company name,Country,Site address,Latitude,Longitude,Province,City
Fortidex S.A.,Ecuador,Km. 1.5 Vía Data Posorja,-2.703285754,-80.24412992,Guayas,Posorja
CIBEL I,Morocco,Zone Portuaire,28.47563515,-11.34286746,Guelmim-Oued Noun,Tan Tan
Khan Traders Fish Meal,Pakistan,"Plot A 342, Block 1 Gulshan-e-Iqbal, Karachi, Karachi City, Sindh, Pakistan",24.922,67.0835,Sindh,Karachi
CIBEL II,Morocco,Zone Industrielle Anza,30.45201,-9.65908,"Agadir Ida-Outanane Prefecture,
Souss-Massa",80752 Anza
Cibel S.A. (Complex Industrial et Commercial Bel Hassan S.A.),Morocco,Complexe Industriel Bel Hassan Quartier Industriel Anza,30.441088,-9.650817,Complexe Industriel Bel Hassan Quartier Industriel Anza,Agadir
Fortidex S.A.,Ecuador,Km. 1.5 De la via El Morro Data de Posorja Planta,-2.701404502,-80.29448339,Guayas,Posorja
COIP (Consortium Industriel De Pêche),Morocco,Rue G Quartier Industriel Anza B.P. 554,30.3228,-9.4894,"Taroudant Province, Souss-Massa",Agadir
Fortidex S.A.,Ecuador,km 19.5 via Durán Tambo,-2.234379972,-79.69927123,Guayas,Posorja
Complexe Industriel des Produits de la Mer (CIPMER) S.A,Morocco,Port d'Agadir B.P. 1711,30.4303,-9.6397,,
Galdecun S.A.,Ecuador,km 7.5 via Manta Mocafuerte,-0.977361,-80.637222,Manabí,Manta
Dardanel Önentaş Gıda Sanayi Anonim Şirketi Balık Unu Fabrikası,Turkey,"Cumhuriyet, İzmir Çanakkale Yolu No:4, 17100 Kepez/Çanakkale Merkez/Çanakkale",40.0921895,26.3991254,"Çanakkale, Marmara region",17100 Çanakkale
Pesquera Diamante S.A.,Peru,Complejo Pesquero S/N,-9.260056556,-78.49373626,"Barranca,
Lima",Supe
Tecnológica de Alimentos S.A. (TASA),Peru,Caleta De Chiguas S/N Km 8.5 Carretera Mollendo Matarani,-17.01571288,-72.06408595,"Barranca,
Lima",Supe
Pesquera Diamante S.A.,Peru,Av. La Marina,-10.7941,-77.7429,"Barranca,
Lima",Supe
Tecnológica de Alimentos S.A. (TASA),Peru,"Av. Los Pescadores,  Zona Industrial 27 De Octubre",-9.114718075,-78.55850777,"Barranca,
Lima",Supe
Ege İz Yem,Turkey,"Merkez Mevkii Gölyeri Sokak No:6, 64902 Kışla/Ulubey/Uşak",38.4887635,29.2437009,"Uşak, Aegean Region",64902 Uşak
GISIS,Ecuador,"R538+W6M, Unnamed Road, Durán, Ecuador
",-2.194299825,-79.83431366,Guayas,Durán
GISIS S.A.,Ecuador,KM 6.5 vía Duran - Tambo,-2.195158,-79.834442,Guayas,Durán
Gümüşdoğa Su Ürünleri Üretim İhracat Ve İthalat A.Ş.Yem Fabrikası,Turkey,dibecik mevkii akyol köyü / Akyol Mahallesi Merkez Sokak No:240/A Milas – MUĞLA,37.2235108,27.6948394,"Muğla,
Aegean Region",Milas
Grupo Varamar,Ecuador,"Q5CM+69 Santa Elena, Ecuador",-2.2294,-80.8166,Santa Elena,Santa Elena
Gürdal Yem Enerji Tarım Gıda Hayvancılık Sanayi ve Ticaret A.Ş. Yem Fabrikası,Turkey,Karacasu - Karaziyaret Mahallesi Fatih Sultan Mehmet Cad. No:26/A Gaziantep Yolu Üzeri 8. Km. Kahramanmaraş,37.54241,36.99458,,
HARINA DE CAMARON HARCAM S.A.S.,Ecuador,"SITIO PORTOVELO, CANTÓN SAN VICENTE",-3.253176,-79.986817,,
İpek Yem ve Gıda San. Tic. A.Ş.-Yem Fabrikası,Turkey,SANAYİ MAH. 60709 NOLU CADDE NO:15 ŞEHİTKAMİL - GAZİANTEP / TÜRKİYE,37.08615,37.41623,,
"New Hope Liuhe Co., Ltd.",China,"No.  1188, Baicao Road, Pixian District, Chengdu City, Sichuan Province",30.7478,103.9583,Shandong,Qingdao
Kardez Su Ürünleri San. Ve Tic. Ltd. Şti. Balık Unu Fabrikası,Turkey,Liman Mah. 2. Sinop Cad. No:124,41.170287,36.709344,"Samsun,
Black Sea Region",Yakakent
HARINA DE PESCADO DE EXPORTACION HARDEPEX CIA. LTDA.,Ecuador,km 4.5 vía Manta- Jaramijó,-0.9487944,-80.647625,,
HARINAS Y CONSERVAS DE PESCADO HARCONPEZ S.A,Ecuador,CIUDADELA URDESA CENTRAL CALLE VICTOR EMILIO ESTRADA # 1107 ENTRE JIGUAS - LAURELES,-2.149656,-80.770399,,
INASA Industrial Aceitera S.A.,Ecuador,Km. 24.5 Via Daule,-2.20188,-79.899034,Guayas,Guayaquil
Pesquera Diamante S.A.,Peru,Prolongaciòn Av. Centenarion N° 1956,-11.9994,-77.1333,"Barranca,
Lima",Supe
Industria Harinera del Pacifico S.A. (INHARIPAC S.A.),Ecuador,JARAMIJO KM 10.5  MANTA-ROCAFUERTE,-0.9939,-80.5975,Manabí,Jaramijó
Karyem Gıda San. İth. İhr. Tic. A.Ş. Yem Fabrikası,Turkey,Keşan Yolu Üzeri D-110 Karayolu 5.km Malkara/TEKİRDAĞ,37.71426,33.58454,,
Pesquera Diamante S.A.,Peru,"Quebrada Agua Lima S/N., Carr. Matarani-Mollendo, Km.6.5",-17.0142,-72.0492,"Barranca,
Lima",Supe
Dinay Bluewave,Morocco,Lot 26 Zone Industrielle Route Martil,35.60675301,-5.312058939,,
Tecnológica de Alimentos S.A. (TASA),Peru,"Panamericana Sur Km 692, Anexo La Punta",-17.686111,-71.331667,"Barranca,
Lima",Supe
Compania Pesquera del Pacifico Centro S.A.,Peru,Av. La Marina 370,-10.79391916,-77.74403856,"Barranca, Lima",11550 Supe
Kiyak Kardesler-Black Sea Co.,Turkey,"Toybelen, 1202 Sokak No:2, 55105 İlkadım/Samsun, Türkiye",41.2942,36.2483,Muğla,Milas
Kılıç Deniz Ürünleri Üretimi İhr.İth. ve Tic. A.Ş. Karma Yem Fabrikası,Turkey,"Kemikler Mahallesi, Güllük - Güvercinlik Arası - 2 Bulvar, No:15/1 Milas-MUĞLA",37.20763,27.6502,,
Koptur Balikcilik Gida San. Nak. ve Tic. Ltd. Sti.,Turkey,Yavuz Grup Yolu 2.km. Çarşıbaşı,41.0744132,39.3863906,"Trabzon,
Black Sea Region",61000 Trabzon
Koptur Balıkçılık Gıda San.Nak.ve Tic. Ltd.Şti. Balık Unu Fabrikası,Turkey,"Merkez Mah. Akmaz Küme Evleri, No:42, 61420 Çarşıbaşı/Trabzon",41.0747966,39.3862986,"Trabzon,
Black Sea Region",61420 Trabzon
ECO VERT PROD,Morocco,Zone Industrielle Gzenaya B Plot 302,35.71371483,-5.89628315,"Prefecture of Tangier - Assilah,
Tanger - Tétouan - Al Hoceima",Tangier
"Marine Acary Production Co.,Ltd",Myanmar,"Yay Kyaw Gyi Kwinn No(917),Ue Pain No(2/8) Katonkani Kyaye Ywar Oke Suu, Bogalaye Tsp, Ayeyarwaddy Region. Oke Suu, Bogalay Township, Ayeyarwaddy Region.",16.286589,95.403879,,#REF!
Min Zar Ni Co. Ltd.,Myanmar,"CJX5+599, Myeik, Myanmar (Burma)",12.4478,98.6096,Tanintharyi Region,Myeik
Industrial Pesquera Junin S.A. JUNSA,Ecuador,"Av. Real Alto, Barrio El Manantial, Chanduy, Provincia de Santa Elena",-2.395,-80.6953,Santa Elena Province,Chanduy
Min Zar Ni Co. Ltd.,Myanmar,"R3XX+9F7, Yangon, Myanmar (Burma)",16.8479,96.0987,Tanintharyi Region,Myeik
Min Zar Ni Co. Ltd.,Myanmar,"4VPP+FW4, Sittwe, Myanmar (Burma)",20.136,92.8874,Tanintharyi Region,Myeik
Lucomercon SA,Ecuador,"4FFP+HJW, Crucita, Ecuador",-0.876,-80.5134,Manabí,Crucita
Musselfeed SE,Sweden,"Hällavägen 57, 474 31 Ellös, Sweden",58.184167,11.469167,Västra Götaland,"Ellös, Orust"
LUIS ANTONIO POZO ASCENCIO,Ecuador,PARROQUIA COLONCHE RECINTO MONTEVERDE,,,,
Manabita de Comercio Mancorsacom S.A.,Ecuador,Via del Pacifico KM 7 –Via Manta – Rocafuerte.,-0.976559,-80.637526,Manabí,Jaramijó
Marine Protein Marprot S.A.,Ecuador,"Urbanización Arroyo Azul, La Pradera, dentro de las instalaciones de EUROFISH",-0.98455,-80.686572,Manabí,Manta
Hai Huong Seafood Joint Stock Company,Vietnam,"Lot No. A8-A9, An Hiep Industrial Zone, Chau Thanh District, Ben Tre Province",106.285443,10.272213,Ben Tre,Chau Thanh
Marine Protein Marprot S.A.,Ecuador,"Av. Hugo Mayo, Urb. Arroyo Azul, Manta-Prov. Manabí",-1.00845017,-80.69089061,Manabí,Manta
Scoular,Myanmar,"Thilawa Industrial Zone, Plot No- 83 & 84, Thanlyin, Kyauk Tan Township. Yangon Division, Myanmar
",16.6719,96.2936,Yangon Region,Yangon
"Vantage Co.,Ltd",Myanmar,"No. 236 Oe Loke Pyin Qr No. 181/182 A/B Inlay Myaing Industrial Zone, Myeik Township, Tanintharyi Region.",12.45677,98.62077,,#REF!
"Yangon Fishery Development Co.,Ltd",Myanmar,"No. 99/B , Seikkann Township:, Zone-3, Yangon Region.",16.79871,96.12967,,#REF!
Aker BioMarine Antarctic AS,Norway,"Anolitveien 1-3, Oslo, Ski 1400, Norway",68.12596,13.85136,,Oslo
Aquarius AS,Norway,8764 LOVUND,66.367331,12.361638,,"Lovund, Lurøy"
Cervonic Ltd.,Mauritius,"Motorway M2,Riche Terre",-20.133612,57.516067,,#REF!
BASF AS,Norway,"Framnesveien 41, 3222 Sandefjord, Norway",59.111549,10.232272,,Oslo
Berg LipidTech AS,Norway,"Sjukenesstranda 62, 6037 Eidsnes, Norway",62.42956,6.33377,,Eidsnes
MULTIPRO_YECTO S.A.,Ecuador,Septor indust. Pto Chanduy,-2.3971,-80.7034472,,
NAGRO S.A.,Ecuador,2kl antes de llegar a Huaquillas,-3.5167806,-80.1804778,,
Negocios Industriales Real S.A. (NIRSA),Ecuador,"7QG4+959, Posorja, Ecuador",-2.724,-80.2445,Guayas,Posorja
Negocios Industriales Real S.A. (NIRSA),Ecuador,"7QJ3+HCM, Posorja, Ecuador",-2.718605,-80.246737,Guayas,Posorja
ECB Company SRL,Italy,"Via Calvenzano, 10, 24047 Treviglio BG, Italy; GH6P+G7 Treviglio, Province of Bergamo, Italy",45.511334,9.585646,Bergamo,Treviglio
Bioceval GmbH & Co KG,Denmark,"Lundagervej 25A, 8722 Hedensted, Denmark",55.7941,9.6711,Hedensted,Hedensted
Generale Conserve S.p.A.,Italy,"Via Corea, 15/17, 07026 Olbia SS; WGR7+6G Olbia, Provincia di Sassari",40.940552,9.513789,Sassari,Olbia
NIRSA S.A.,Ecuador,"Malecón Carlos Baidal Tirsio y Av. Carvajal, Barrio 12 de abril. Posorja",-2.171454,-79.887926,Guayas,Posorja
Kauluan Sdn Bhd,Malaysia,"F-2-15, Blok F, Tingkat 2, Lorong Inanam Kapital 5, Inanam Kapital, 88450 Kota Kinabalu, Sabah
(Factory): Kampung Lubok Poring, Sepanggar, Kota Kinabalu, Sabah, Malaysia",5.98795,116.13058,,#REF!
QL Marine Products Sdn.Bhd.,Malaysia,"Kampung Bolong, P.O.Box 502, 89208, Tuaran, Sabah",6.181033925,116.2279712,,#REF!
Kim Long Fish Meal,Vietnam,"Lô C11, Phú Hài, Thành phố Phan Thiết, Bình Thuận 12000, Vietnam // W4VP+M9 Phan Thiết, Bình Thuận, Vietnam",10.944137,108.135906,Binh Thuan,Phan Thiet
Camau Seafood Processing & Service Joint Stock Corporation,Vietnam,"04, Nguyen Cong Tru Str., Ward 8, Ca Mau City, Ca Mau Province, Vietnam",,,Ca Mau,Ca Mau City
GIL COMES M'LALEH 2,Morocco,Nouveau Port,35.19107619,-6.133722109,"Larache Province,
Tanger - Tétouan - Al Hoceima",92000 Larache
Lucky Fish Uğurlu Balık Üretim Sanayi ve Ticaret A.Ş.,Turkey,"Denizköy, 25 Atanaj Deresi Mevkii, 09270 Didim/Aydın, Türkiye",37.4357874,27.3628227,"Aydın, Aegean Region",09270 Aydın
Nektar Yem ve Yem Katkı Maddeleri Gıda Hayvancılık Sanayi Ticaret Limited Şirketi-Tire,Turkey,"İbni Melek OSB Mah. Tosbi Yol 13 Sk. No: 1/1
Merkez – Tire / İZMİR",38.11476,27.70352,,
Noordzee Su Ürünleri İhracat Sanayi ve Ticaret Anonim Şirketi Yem ve Kedi Köpek Maması Fabrikası,Turkey,Noordzee Su Ürünleri A.Ş. Kocakışla Mahallesi / Güllük / Muğla / TÜRKİYE,37.24186,27.63353,,
NU MEGA INGREDIENTS ECUADOR NMI S.A.,Ecuador,KM 5.5 VIA MANTA - ROCAFUERTE - CANTON JARAMIJO,,,,
NUTRIFISHING S.A,Ecuador,AV. ISIDRO AYORA Y AV. JOSE LUIS TAMAYO CC. POLARIS BLOQUE#3 PISO 1 OF. 11,-2.240198,-80.816212,,
Noordzee Su Ürünleri Söke Yem Fabrikası,Turkey,"Söke OSB, 09220 Söke/Aydın, Türkiye",37.7552987,27.4400928,"Aydın, Aegean Region",Aydın
Golden Lead Import and Export Trade Co. Ltd.,Gambia,Kajabang Quarter,13.1547,-16.7788,Brikama,Gunjurr Bato Sateh (Kajabang)
Ch. Daudruy Van Cauwenberghe,France,"253 Rue Georges Vancauwenberghe, 59640 Dunkerque, France",51.0029,2.3241,Hauts-de-France,Dunkerque
Copalis Industrie,France,"220 Rue du Petit Port, 62480 Le Portel, France",50.7198,1.5787,Hauts-de-France,Le Portel
Groupe Adrien,France,"35 Rue des Émeraudes, 38280 Villette-d'Anthon, France",45.7949,5.1331,Auvergne-Rhône-Alpes,Villette-d'Anthon
Independent Fisheries Limited,New Zealand,"64 Broad Street, Woolston,Christchurch 8023",-43.560995,172.689339,,#REF!
Setalg,France,"83 Rue de Pen Lan, 22610 Pleubian, France",48.857,-3.0773,Bretagne,Pleubian
P D-PESCA,Ecuador,Jaramijó,-0.9747944,-80.6574917,,
Vietnam Food Joint Stock Company,Vietnam,"4573+VQ, Cái Nước District, Ca Mau, Vietnam // KCN Hòa Trung, ấp Hòa Trung, Lương Thế Trân, Cái Nước, Cà Mau, Vietnam",9.1161,105.1524,Ca Mau,Hoa Trung
OLVEA Omega Solutions,France,"110 Rte de Valmont, 76400 Fécamp, France",49.7564,0.3946,Normandie,Fécamp
PEANDRES S.A,Ecuador,Pto Chanduy,-2.3997694,-80.7008639,,
Sealord Group Limited,New Zealand,"149 Vickerman Street, Port Nelson, Nelson 7010, New Zealand",-41.2569,173.2796,Nelson,Nelson
Sing Viet Song Doc Fish Meal Company Limited,Vietnam,"Khóm 7, Trần Văn Thời District, Ca Mau 98406, Vietnam",9.04188,104.835977,Ca Mau,Tran Van Thoi
Biomega AS,Norway,"Skaganeset 15, 5382 Skogsvåg, Norway",60.2689,5.1052,Vestland,Skogsvag
C & H Fish S.A.C.,Peru,"Playa Oquendo N° 657, Fundo San Agustõn",-12.0157,-77.1361,Callao,Callao
Pesquera Centromar S.A.,Ecuador,"J73W+J5V, Chanduy, Ecuador ",-80.70461171,-2.395808541,,
Andecorp S.A.C.,Peru,Av Prolongacion Centenario N° 600,-12.0164,-77.136,Callao,Callao
BLT Berg LipidTech AS,Norway,"Sjukenesstranda 62, 6037 Veibust, Norway",62.430152,6.3345172,,Veibust
ALIMENTOS LOS FERROLES S.A.C.,Peru,Av Prolongacion Centenario N° 1960,-11.986113,-77.133409,"Callao,
Constitutional Province of Callao",Callao
Inversiones Pesqueras Liguria S.A.C.,Peru,"Av. Los Ferroles S/N, Parcela C, Zona Industrial Santo Domingo De Bocanegra",-12.00242174,-77.1308898,"Callao,
Constitutional Province of Callao",Callao
Phuong Dong Seafood Limited,Vietnam,"Lot 17D, Street 05, Tra Noc Industrial Zone, Can Tho City",10.106574,105.704386,Can Tho,Can Tho
Normfeed Su Ürünleri Yem Sanayi Ticaret A.Ş.,Turkey,Subaşı Mah. 229. Sok. No:12 Merkez Torbalı,38.1032219,27.4229919,"Izmir,
Aegean Region",Izmir
King Car Industrial,Vietnam,"Lô A3, Phân khu Formosa, KCN Nhơn Trạch III, Nhơn Trạch, Đồng Nai, Vietnam",10.71908372,106.9328918,Chang Wat Samut Sakhon,Tambon Bang Kachao
Calanus AS,Norway,"Lilandveien 20, 8407 Sortland, Norway / Postboks 207, 8401 SORTLAND",68.7356,15.5191,Nordland,Sortland
Compania Pesquera del Pacifico Centro S.A.,Peru,Av.Industrial Lado Oeste S/N.,-13.44907222,-76.18590845,"Chincha, Ica",11702 Chincha Alta
Pesquera Herco SA,Ecuador,"Parroquia Chanduy, Canton Santa Elena, Provincia de Santa Elena",-2.3956,-80.7071,Santa Elena,Chanduy
Chau Do Joint Stock Company,Vietnam,"Area B5, ThoQuang storm shelter and anchoring of boats, ThoQuang ward, Son Tra district, Da Nang city, Viet Nam",16.101588,108.242181,Da Nang,Tho Quang
Özpekler Insaat Taahhüt Dayanikli Tüketim Mallari Su Ürünleri San. Ve Tic. Ltd. Sti.,Turkey,Deri İhtisas Organize Sanayi Bölgesi Kaklık Mah. 8. Sokak No:2 Honaz /Denizli,37.861793,29.388432,"Denizli,
Aegean Region",Denizli
PINDHAGON S.A.,Ecuador,Comuna Jambelí,-2.0479944,-80.7150861,,
Viet Truong Seafood Processing and Import-Export Co. Ltd,Vietnam,"RMHF+V5R, Vĩnh Niệm, Lê Chân, Hai Phong, Vietnam",20.828641,106.672436,Dong Thap,Lấp Vò District
Asia Fish Oil Corporation,Vietnam,"8FQV+FP7, Bình Thành, Lấp Vò District, Dong Thap, Vietnam",10.3383,105.4945,Dong Thap,Sa Đéc
Mavin Austfeed Joint Venture Company Limited - Mavin Group,Vietnam,"7V78+FJR, Cụm CN Cái Tàu Hạ An Nhơn, Châu Thành, Đồng Tháp, Vietnam",10.262537,105.866249,Dong Thap,Vinh Long
Epax Norway AS,Norway,"Aarsæthervegen 17, 6006 Ålesund, Norway
",62.463747,6.11954,,Ålesund
GC Rieber VivoMega AS,Norway,"Teistholmsundet 5, 6512 Kristiansund, Norway
",63.120016,7.757345,,Kristiansund
Fish oil refinery company IDI,Vietnam,"Bình Thành, Lấp Vò District, Dong Thap, Vietnam // 8FQV+8R Lấp Vò District, Dong Thap, Vietnam",10.338232,105.494598,Đồng Tháp,Lấp Vò
Prometa Yem ve Endüstriyel Yağ San. Tic. A.Ş.,Turkey,İstiklal Kurtpınar OSB Mah. Atatürk Cad. No:20/1 Merkez Muratlı,41.1945297,27.5151371,"Tekirdağ,
Marmara Region",Tekirdağ
Samsun Balıkçılık Su Ürünleri Hayv. İnş. Tur.Plas. Meş. San. Tic. Ltd. Şti.,Turkey,"Aktekke, Bafra OSB, Bafra/Samsun",41.5070293,35.8495787,"Samsun,
Black Sea Region",Samsun
Samsun Balıkçılık Su Ürünleri San. Tic. Ltd. Şti.- Yem Fabrikası,Turkey,Kıran Mah. Toybelen Yolu 11. Km No:328/2 ilkadım Samsun,41.30415,36.2506,,
Serhan Company Tar. Gıda İnş. Pet. Kuyumculuk San. ve Tic. Ltd. Şti-Yem Üretimi,Turkey,"Organize sanayi bölgesi 1. Bulvar No: 24/2, Artuklu/Mardin",37.28218,40.67082,,
LTD MBM,Georgia,,,,,
Sibal Plastik ve Su Ürünleri Değerl. San. ve Tic. A.Ş. Yem Fabrikası,Turkey,Birlik Cad. No:18 Beysan San.Sit. Beylikdüzü / İSTANBUL,41.00262,28.68168,,
IDI Corporation,Vietnam,"8FPV+P9V, Bình Thành, Lấp Vò, Đồng Tháp, Vietnam",10.336663,105.493303,Đồng Tháp,Lấp Vò
Procesadora Exportadora del Pacifico S.A. PROEXPCSA,Ecuador,"Juan Pereira, y, Pedernales 131001, Ecuador; XVPR+RQ Pedernales, Ecuador",-0.0134874,-80.1082993,Manabí,Pedernales
TRISEDCO - Fish Meal Fish Oil Factory Pangasius,Vietnam,"Bình Thành, Lấp Vò District, Dong Thap, Vietnam",10.338818,105.495325,Đồng Tháp,Lấp Vò
M/s. A-ONE FISH MEAL,Pakistan,"Plot No.  C-6, C-8, Ibrahim Hyderi, Industrial Area, Korangi Creek, Karachi, Pakistan.",24.82471,67.17456,,Karachi
Kovie Vina Co. Ltd.,Vietnam,"Lot D, Binh Long industrial zone, Binh Long commune, ChauPhu district, An Giang province, Viet Nam",10.564946,105.250693,Đồng Tháp,Lấp Vò District
Productora Marvivo S.A. PROMARVI,Ecuador,"El Real, Chanduy",-2.3919528,-80.7148194,,
Productos Pesqueros S.A. Produpes,Ecuador,Km 3 1/2 Via Barranco Prieto Manta-Manabi,-1.0122,-80.6888,Manabí,Manta
Proteina de Ecuador Ecuaprotein S.A.,Ecuador,Lotización Fincas Vacacionales Las Brisas Solar 19,-2.203728,-79.829393,Guayas,Durán
Proveedores de la Costa Provecosta CIA. LTDA.,Ecuador,BARRIO CONCHA ALVAREZ (VIA PANAMERICANA) - CANTON SANTA ROSA - EL ORO,,,,
REMO ROHN S.A.,Ecuador,Anconcito,-2.3355556,-80.8911444,,
Sibal Pls. ve Su Ürn.Değ.San.ve Tic. A.Ş. Balık Unu Fabrikası,Turkey,"Lala Mevkii, Gerze / SİNOP",41.870172,35.1032721,"Sinop,
Black Sea Region",Sinop
Hawkes Bay Protein Limited,New Zealand,"50 Waitangi Road, Awatoto, Napier 4110, New Zealand",-39.5425,176.9186,Hawke's Bay,Napier
VinhHoan Corporation,Vietnam,"National Road 30, Ward 11, Cao Lanh City, Dong Thap, Viet Nam",10.5034318,105.5652277,Dong Thap Province,Cao Lanh
Fish meal and fish oil procesing factory- Vinh Phuoc Food Company Limited.,Vietnam,"7V77+64V, Ấp An Phú, Xã, An Nhơn, Châu Thành, Đồng Tháp, Vietnam",10.263003,105.863862,Dong Thap Province,Chau Thanh
Pesquera 2020 S.A.C.,Peru,Av. La Marina S/N,-10.7499,-77.7597,Gobierno Regional de Lima,Barranca
Skretting Yem Üretim Tic. A.Ş,Turkey,"Kocakışla Mahallesi, Hocatönü Mevkii Güllük, 48670 Milas/Muğla, Türkiye / Ekinanbarı Mah. Kocakışla Sokak No:5 48670
Güllük Milas, Muğla - Türkiye",37.2369091,27.6561108,"Muğla,
Aegean Region",Güllük
Sursan Aqua,Turkey,8G996JQX+78,37.2382,27.6483,Samsun,Samsun
Rosmei SA,Ecuador,"“Manantial de Chanduy” Enclosure, Chanduy Parish, Santa Elena Canton, Santa Elena Province",-2.4064,-80.6925,Santa Elena,Chanduy
ROSMEY S.A.,Ecuador,"Barrio Pto. Nuevo, Canduy",-2.3890611,-80.6951056,,
M/S Balochistan Marines Products，Pakistan,Pakistan,"Village Shanka Nidar, Main Coastal Highway, Gwadar,Pakistan. Plot#389/390,Main Ibrahim Hyderi, Industrial, Korangi, Karachi,Pakistan",24.82471,67.17456,,Gwadar
Segundo Felipe Asecncio Rivera,Ecuador,Comuna Jambelí,-2.0464194,-80.714675,,
Industrial Don Martin S.A.C.,Peru,Av. Pedro Luna Arrieta N° 479,-11.1211,-77.6123,Gobierno Regional de Lima,Huacho
Pioneer Fishing (Pty) Ltd,South Africa,SANDY POINT HARBOUR ST HELENA BAY,-33.9209,18.4236,Western Cape,St Helena Bay
Pesquera Nemesis S.A.C.,Peru,Av. Bahia De Marineros S/N,-11.4978,-77.2151,Gobierno Regional de Lima,Huaral
TASA,Peru,Caleta Végueta S/N,-17.0158,-72.0636,Gobierno Regional de Lima,Supe
TASA,Peru,Caleta Cata Cata Alt. Km 4.5 De La Carretera Costanera Sur,-9.2579,-78.4963,Gobierno Regional de Lima,Supe
Pak China Fish Meal,Pakistan,"K.E-01,Sachay Dino Syed Para Rehare Landhi,Karachi ,Pakistan",24.84462,67.20139,,Karachi
TASA,Peru,Carretera Pisco Paracas Km. 17.1 / Km. 15.5 De La Carretera Pisco-Paracas,-11.00693173,-77.65232602,Gobierno Regional de Lima,Supe
TASA,Peru,Caleta Chiguas Km. 8.5,-17.6757,-71.3637,Gobierno Regional de Lima,Supe
TASA,Peru,"Sub Lt. 3A -1B, Zona Industrial",-13.7975,-76.2428,Gobierno Regional de Lima,Supe
TASA,Peru,"Av. Nestor Gambeta Km. 14.1-Ex Fundo Márquez, Callao Norte",-11.9566,-77.1334,Gobierno Regional de Lima,Supe
Tecnológica de Alimentos S.A. (TASA),Peru,Tierra Colorada,-7.694242105,-79.43461271,Gobierno Regional de Lima,Supe
TripleNine,Denmark,"Sydhalevej 14, 7680 Thyborøn, Denmark",56.6992,8.2195,Thyborøn,Thyborøn
TripleNine,Denmark,"Fiskerihavnsgade 35, 6700 Esbjerg, Denmark",55.4688,8.4338,Thyborøn,Thyborøn
C.P. Vietnam Corporation,Vietnam,"C.P. Vietnam Corporation, 2, 2A Street , Bien Hoa Industrial Zone II ,Bien Hoa City, Dong Nai Province, Long Bình Tân, Biên Hòa, Đồng Nai, Vietnam",10.9094,106.8534,Hải Phòng,Lê Chân
Vietnam Food Hau Giang Joint Stock Company,Vietnam,"Khu công nghiệp, Đông Phú, Châu Thành, Hậu Giang, Vietnam",9.961263,105.849413,Hau Giang,Dong Phu
Pesquera Juanita S.R.L.,Peru,Calle Siete S/N Lt. 1,-11.0874,-77.628,"Huaural,
Lima",Caleta de Carquín
Industrial Maule Ltda,Chile,"AV FORESTAL 1100 PARQUE INDUSTRIAL,
CORONEL, REGION DEL BIO",-36.97598,-73.17365,,
Seimar,Ecuador,"Q57H+HJ Santa Elena, Ecuador",-2.236,-80.821,Santa Elena,Santa Elena
Industrial Maule Ltda,Chile,"Av. Golfo De Arauco 3638, 4191781 Concepción, Coronel, Bío Bío, Chile",-36.9698,-73.1677,,
Industrias Isla Quihua S.A.,Chile,AV MATTA 203 LOTA REGION DEL BIOBIO,-37.09485,-73.15792,"Provincia de Concepción,
Biobío Region",Lota
Procesadora del Campo S.A.C.,Peru,Av. San Martín N° 680,-11.08838643,-77.62748243,"Huaural,
Lima",Caleta de Carquín
Pesca Peru Tambo De Mora Norte S.A.,Peru,Av. Industrial S/N,-13.4195,-76.1337,Ica,Chincha Alta
Transmarina Del Peru Sociedad Anonima Cerrada - Transmarina Del Peru S.A.C.,Peru,"Mz. E Lt.s 01 Y 02, Urbanizacion Lotizacion Industrial Santa Elena De Paracas",-13.7786,-76.2372,Ica,Pisco
TECNOLOGICA DE ALIMENTOS S.A.,Peru,Carretera Costanera Sur Km. 4.5,-17.6794,-71.3633,"Ilo,
Moquegua",18601 Ilo
Biomar Ercilla,Chile,"Ruta 5 Km 1076 Pargua, Calbuco, Región de Los Lagos",-73.42621805,-41.77939111,"Provincia de Llanquihue,
Los Lagos Region",Bahía Pargua
Sardinas de Sonora SA de CV,Mexico,"Calle sin nombre, Lote 2 Manzana B D, Parque Industrial Pesquero Rodolfo Sánchez Taboada, C.P. 85489, Guaymas, Sonora, México.",27.8767,-110.8728,Sonora,Guaymas
Grontvedt Nutri,Norway,"Havneveien 1, 7142 Uthaug, Norway",63.7276,9.591,Trøndelag,Uthaug
Ecopelag AB,Sweden,"Båtvägen 6, 593 50 Västervik, Sweden",57.74757548,16.67361185,Kalmar,Västerviks Kommun
TECNOLOGICA DE ALIMENTOS S.A.,Peru,Carretera Panamericana Sur Km. 692,-16.2287793,-73.69521877,"Ilo,
Moquegua",18601 Ilo
Corporacion Pesquera Inca S.A.C.,Peru,"Caleta Cata Cata, Parcela A-1",-17.68423,-71.36815883,"Ilo,
Moquegua",18601 Ilo
Corporacion Pesquera Inca S.A.C.,Peru,"Calle Alcatraz N° 177, Distrito Chancay",-11.57884194,-77.26743359,"Ilo,
Moquegua",18601 Ilo
Corporacion Pesquera Inca S.A.C.,Peru,"Sub-Lt. B S/N, Puerto Malabrigo",-7.708495413,-79.410536,"Ilo,
Moquegua",18601 Ilo
Productos Pesqueros de Guaymas,Mexico,"R. Sanches, Lote 3 y 4 manzana H, Sánchez Taboada s/n, Gral Rodolfo Sánchez Tabo, 85486 Guaymas, Son., Mexico",27.87967,-110.87012,Baja California,Guaymas
Corporacion Pesquera Inca S.A.C.,Peru,"Calle 2 (Calle El Milagro) N° 101, Mz. E, Lt. O, Zona Lotizacion Industrial Gran Trapecio",-9.1092,-78.5614,"Ilo,
Moquegua",18601 Ilo
Hofseth BioCare,Norway,Stormyrvegen 52,62.690981,6.669082,Møre og Romsdal,Midsund
Africa Peche,Mauritania,Zone Industrielle De Bountiya,20.9128,-17.0308,Dakhlet Nouadhibou,Nouadhibou
Africa Proteine,Mauritania,Lot 27 Zone Industrielle De Bountiya,20.913856,-17.031879,Dakhlet Nouadhibou,Nouadhibou
Al Watania Pour la Peche,Mauritania,PK 65,18.5978,-16.0992,Nouakchott,North Nouakchott
Alfa Service Ltd,Mauritania,Ilot 37/39 Zone Industrielle De Bountiya,20.9139878,-17.0279578,Dakhlet Nouadhibou,Nouadhibou
Pesquera Rubi S.A.,Peru,Caleta De Cata Cata Carretera Costanera Sur,-17.68258771,-71.37146203,"Ilo, Moquegua",18601 Ilo
Hordafor AS,Norway,"Fiskerihamnvegen 42 Salthella, 5397 Bekkjarvik",60.00317,5.11618,,Bekkjarvik
Long Sinh Company Limited,Vietnam,Factory address: Lot B5 & B6 - Suoi Dau Industrial Park - Suoi Tan Commune - Cam Lam District - Khanh Hoa Province,12.150785,109.06992,Khanh Hoa,Cam Lam
ATLANTIC PECHE,Mauritania,Zone Industrielle De Bountiya,20.91251471,-17.03355516,Dakhlet Nouadhibou,Nouadhibou
Atlantic Protein,Mauritania,Zone Industrielle De Bountiya,20.91251471,-17.03355516,Dakhlet Nouadhibou Region,Nouadhibou
Qingdao Kangjing Marine Biotechnology Co. Ltd.,China,,,,,#REF!
Minh Tam Fish Meal Processing Company Limited,Vietnam,"V47J+GC8, QL63, Bình An, Châu Thành, Kiên Giang, Vietnam",9.863827,105.131206,Kien Giang,Chau Thanh
Karmsund Protein AS,Norway,"Husøyvegen 141, 4262 Avaldsnes",59.33793,5.29159,,Avaldsnes
Atyfen SARL,Mauritania,Zone Industrielle De Bountiya,20.9146,-17.028453,Dakhlet Nouadhibou,Nouadhibou
"Tac Cau Fish Meal Processing Area
",Vietnam,"V44M+GVG, Bình An, Châu Thành, Kiên Giang, Vietnam",9.856337,105.13505,Kien Giang,Chau Thanh
"Minh Tâm Fishmeal Co.,Ltd",Vietnam,"X49C+4HM, Phường An Bình, Rạch Giá, Kiên Giang, Vietnam",9.967822,105.121462,Kien Giang,Rach Gia
Pesquera Z Y T S.A.C.,Peru,"Panamericana Norte Km. 191.3, Sub Lt. No 2, Fundo San Jose, Barrio Reparticion",-7.3395,-79.5033,La Libertad,San Martín de Porres
Fishpro Nor Peru S.A.C.,Peru,Zona Industrial Km. 45.3 Carretera Sullana-Paita,-8.138,-79.0272,La Libertad,Trujillo
Alimentos Finos Del Pacifico S.A.,Peru,"Calle Bahía Paracas S/N Zona Industrial, Los Ferroles",-12.002401,-77.128718,Lima,Callao
Fiordo Austral S.A,Chile,"Loteo Ruze Canadon 33, Porvenir Chile",-70.3891,-53.2908,Magallanes y la Antártica Chilena,Porvenir
Fiordo Austral S.A,Chile,"Jose María Caro N° 600 Puerto Chacabuco, Chile",-72.8202,-45.4569,Magallanes y la Antártica Chilena,Porvenir
Fiordo Austral S.A,Chile,"42°22'33.7""S 73°45'42.1""W, Castro, Los Lagos, Chile",-73.7617,-42.376,Magallanes y la Antártica Chilena,Porvenir
