Company name,Country,Site address,Latitude,Longitude,Province,City
CFG Investment S.A.C.,Peru,Av. Industrial s/n Ex Fundo Canchamana,-13.4328,-76.1874,Áncash,Chimbote
Agromey Gıda ve Yem San. Tic. A.Ş.Torbalı Yem Fabrikası,Turkey,29 Ekim Mah. Simge Cad. No:22 Yazıbaşı Torbalı / İZMİR,38.22503,27.323,,
CFG Investment S.A.C.,Peru,"Zona Industrial Norte Mza. Vi Lt. A, Puerto Malabrigo",-7.6829,-79.433,Áncash,Chimbote
Pesquera Hillary E.I.R.L.,Peru,"Av. Los Pescadores N° 1150, Mz. A, Lt. 5, Zona Industrial",-9.1139,-78.5438,Áncash,Chimbote
BARACAMAR S.A.,Ecuador,km 1.5 vía Sta. Elena - Guayaquil,-2.2398917,-80.8160806,,
Tangawira Sdn. Bhd.,Malaysia,"Jayadiri Compound, No.  1A, Jalan Jayadiri, P.O.Box 448, 89058 Kudat, Sabah.",116.8501461,6.877635075,,#REF!
Avanti Feeds Limited - SSMD,India,"Unnamed road, Kanuru",16.8639657,81.6924814,Andhra Pradesh,"Atlapadu, East Godavari, 534329"
Avanti Feeds Ltd,India,beside Railway station,17.007284,81.72961,Andhra Pradesh,"Kovvur, Vemuluru, 534350"
CFG Investment S.A.C.,Peru,"Carretera Pisco, Paracas Km 15.5",-13.78210412,-76.238552,Áncash,Chimbote
Pesquera Miguel Angel S.A.C.,Peru,Au. Panamericana Norte. 100,-9.012629,-78.618426,Áncash,Chimbote
Cmm Products S.A.C.,Peru,"Av. Per⁄ Mz. N, Lt. 1-6, Pueblo Joven Villa Marõa",-9.1194,-78.5506,Áncash,Chimbote
Bawa Fish Meal & Oil Co.,India,"15-5/1 Sasihithlu, Mukka",13.031824,74.784847,Karnataka,"Mangaluru, Dakshina Kannada, 574146"
PT. Argopuro Berkat Indonesia,Indonesia,"JG29+4WJ, Krajan II, Wringinanom, Kec. Wringinanom, Kabupaten Gresik, Jawa Timur 61176, Indonesia",-7.4,112.5196,,
PT. Argopuro Berkat Indonesia,Indonesia,"Jl. Imam Bonjol No. 55, Tukangkayu, Kec. Banyuwangi, Kabupaten Banyuwangi, Jawa Timur 68411, Indonesia",-8.215077,114.376695,,
CV Indo Jaya Pratama,Indonesia,"H84P+QHH, Jl. Kedung Rejo, Dusun Kalimati, Kedungrejo, Kec. Muncar, Kabupaten Banyuwangi, Jawa Timur 68472, Indonesia",-8.443,114.3365,,
Marjan Seafood Company,Iran,"6CX7+J9M, Abadan, Khuzestan Province, Iran",30.2486,48.4133,,Cavib-deh
Inversiones Oslo S.A.C.,Peru,"Av. Principal S/N, Zona Industrial Gran Trapecio",-9.0561,-78.5767,Áncash,Chimbote
Pesquera Op7 & Bell S.A.C. / Op7 & Bell S.A.C.,Peru,"Calle 03, Mz. B, Sub Lt. 1 A, Zona Industrial Gran Trapecio",-9.106960638,-78.56186974,Áncash,Nuevo Chimbote
Group Corporation Reye's S.A.C.,Peru,"Av. Principal Mz. C, Lt. 9, 10 Y 11, Zona Industrial Gran Trapecio",-9.1547,-78.5018,Áncash,Nuevo Chimbote
Inversiones Regal S.A,Peru,"Esquina De Las Calles Brasil Y Kennedy S/N, Mz. L. Lt. 1-8, Villa Maria",-9.1462,-78.4993,Áncash,Nuevo Chimbote
Sarana Tani Pratama,Indonesia,"JH8G+JF5, West Tegal Badeng, Negara, Jembrana Regency, Bali, Indonesia",-8.3837,114.576,,
Conservera San Lucas S.A.C.,Peru,"Pueblo Joven Villa Marõa Mz. O, Lt. 1-8",-9.1462,-78.4993,Áncash,Nuevo Chimbote
"Century Pacific Food, Inc.",Philippines,"9500 National Hwy, General Santos City, South Cotabato, Philippines",6.121641152,125.1440814,,General Santos City
Bawa Fishmill & Oil Co.,India,"1-15(1) & 1-15(2), Kotepura",12.834715,74.832957,Karnataka,"Ullal Industrial Area, Mangaluru, 575020"
"Universal Canning, Inc.",Philippines,"XW4X+HQ7, Calle San Isidro, Zamboanga, 7000 Zamboanga Sibugay, Philippines",6.956412136,121.9494144,Zamboanga Peninsula,Zamboanga
Southwest Asian Canning Corporation (SACC),Philippines,"Purok 1, Zamboanga, 7000 Zamboanga del Sur, Philippines",6.975164965,121.9355069,Zamboanga Peninsula,Zamboanga
Bismi Aquatic Products,India,"No 50/1, Paandukudi Rd, Machur Village, Vattanam Post",9.78345,79.04104,Tamil Nadu,"Thondi, Thiruvadanai, Ramanathapuram, 623409"
Sumber Protein,Indonesia,"H85P+2Q3, Dusun Sampangan, Kedungrejo, Kec. Muncar, Kabupaten Banyuwangi, Jawa Timur 68472, Indonesia",-8.4425,114.3371,,
SLORD Development Corporation,Philippines,"FDA Fishport Complex Navotas, Metro Manila, Philippines 1485",14.638435,120.955051,,Manila
FKS Multi Agro,Indonesia,"H86P+4C3, Dusun Muncar, Kedungrejo, Kec. Muncar, Kabupaten Banyuwangi, Jawa Timur 64872, Indonesia",-8.4394,114.3357,,
Copacol (Cooperativa Agroindustrial Consolata),Brazil,"9MCG+C9 Centro, Cafelândia - PR, Brazil",-24.6289,-53.3241,Paraná,Cafelândia
ZC E & L Corporation,Philippines,"XW9P+PXH, Zamboanga, Zamboanga Sibugay, Philippines",6.969326605,121.9374834,Zamboanga Peninsula,Zamboanga
PT. Sahabat Nelayan Jaya Mandiri,Indonesia,"47GX+CH Demangharjo, Tegal Regency, Central Java, Indonesia",-6.873624,109.298914,,
Permex Producer and Exporter Corporation,Philippines,"Zone 8, Calle Fatima, Ayala, 7000, Zamboanga City, Philippines",6.96663763,121.9397445,,#REF!
Bismi Fisheries Pvt. Ltd,India,"R.S.No. 738/1B, Thoduvai Main Road",11.23913664,79.83751255,Tamil Nadu,"Thirumullaivasal, Sirkali, 609113"
Gold Star Seafoods,Philippines,"XWGM+5QV, Zamboanga, Zamboanga Sibugay, Philippines",6.975540891,121.9344047,,#REF!
Fábrica de Conservas - La Gondola Lda,Portugal,"R. Dom Marcos da Cruz Lotes 19-20, 4455-482 Perafita, Portugal; 6883+X3 Perafita, Portugal",41.217438,-8.697254,Matoshinos,Perafita
PT. Sari Laut Jaya Food Products,Indonesia,"Jl Sampangan B1/A, Dusun Kedungrejo, Kec. Muncar, Kabupaten Banyuwangi, Jawa Timur 68472",-8.44102,114.341752,,
PT Sumber Yalasamudra,Indonesia,"Jl. Sampangan No. 19, Dusun Sampangan, Kedungrejo, Kec. Muncar, Kabupaten Banyuwangi, Jawa Timur 68472, Indonesia",-8.4411,114.341,,
"Empresa Figueirense de Pesca, LDA",Portugal,"R. Maj. Humberto Cruz 43, 3090 Figueira da Foz, Portugal / RUA DA VOLTINHA S/N ARMAZENS DE LAVOS",40.1434,-8.846,Coimbra,Figueira da Foz
PT. Toba Surimi Industries,Indonesia,"PQCX+5G8, Pasir Bidang, Sarudik, Central Tapanuli Regency, North Sumatra 22524, Indonesia",1.720479,98.799124,,
AR Global Fishmeal,Indonesia,"6V4Q+49 Glondonggede, Tuban Regency, East Java, Indonesia",-6.79468,111.88834,,
Biji Sesawi,Indonesia,"Desa Kedungrejo, Kec. Muncar, 58252 Jawa Timur // H84P+88 Kedungrejo, Banyuwangi Regency, East Java, Indonesia",-8.44431,114.33578,,
Blue Aqua Products,India,"2/128, Survey no 204, 3B 5B",8.909633,78.175661,Tamil Nadu,"Pattinamartur Village, Ottipadaram, Thoothukudi, 628105"
"Narciso Dias & Filhos, Lda.",Portugal,"Apartado 8 Zona Portuária, Ajuda",39.35318,-9.365073,"Grande Lisboa,
Área Metropolitana de Lisboa",2520-206 Peniche
"Bombana Raya, CV",Indonesia,"Jl. Perkuburan Kel.Lampopala Desa Lampopala, Kec. Rumbia, 93771 Sulawesi Tenggara",,,,
CV SUMBER REJEKI MAKMUR SEJAHTERA,Indonesia,"H82Q+G96, Dusun Stoplas, Kedungrejo, Kec. Muncar, Kabupaten Banyuwangi, Jawa Timur 68472, Indonesia",-8.44867,114.33887,,
Blueline Foods (India) Pvt. Ltd. Unit-IV,India,"Khammam, Devarapalli Rd",17.0633374,81.55309,Andhra Pradesh,"Brundhavanapuram, Bandapuram, Gollagudem, 534316"
Blueline foods India Pvt. Ltd Unit - I,India,"Near Mogaveera Higher Primary School, Beach Rd",12.820523,74.838554,Karnataka,"Ullal, Mangaluru, 575020"
Blueline Foods India Pvt. Ltd Unit - III,India,"Door No. 1-5, Kotepura",12.832806,74.833764,Karnataka,"Ullal, Mangaluru, 575020"
C P Aquaculture-Chennai,India,"104, GNT Rd, Red Hills",13.21458277,80.16910885,Tamil Nadu,"Siruniam, Chennai, 600052"
Coastal Aquatic Proteins,India,"1st Floor, Coastal Building, Goods Shed Rd, behind Rosario School",12.857255,74.835081,Karnataka,"Dakshina Kannada, Mangaluru, 575001"
Diamond Aqua Fishes Meal,India,"2/148, Survey No. 204/3B5B",8.909587,78.175505,Tamil Nadu,"Pattinamartur Village, Ottipadaram, Thoothukudi, 628105"
Fahad Fishmeal & Oil Company,India,"Door No.  1-1-6, Sea Rd",12.837659,74.832018,Karnataka,"Kotepura, Ullal, Mangalore, 575020"
Finley Marine Products,India,"Survey No.  372/2, Uralvoimozhi Rd, Irukanthurai Village Part-II",8.206909,77.662529,Tamil Nadu,"Nakkaneri, Radhapuram, Valliyoor, 627111"
Global Marine Exports,India,"Plot No.  G2, Taloja MIDC Industrial Area",19.06295,73.12095,Maharashtra,"Panvel, Navi Mumbai, 410208"
Godrej Agrovet Limited - Barabanki Plant,India,"Plot C-1/4, Phase 2 Agro Park, Kusri Rd",27.01563667,81.04044359,Uttar Pradesh,"Barabanki, 225001"
Godrej Agrovet Limited - Kondapalli Plant,India,"Plot No.  111A-135, Industrial Development Area",16.645045,80.5525466,Andhra Pradesh,"Kondapally, Krishna, 521228"
Hameed Marine Private Limited,India,"Door No.  2/1-D, Survey No.  886/3C, Irrukandurai Village",8.20932,77.65694,Tamil Nadu,"Radhapuram, Tirunelveli, 627106"
Hind Aquatic,India,Darad Vadh Rd,23.20783,68.708952,Gujarat,"Jakhau, Kutch, 370640"
HKA Bawa & Sons,India,"15-5/1, Sasihithlu, Mukka",13.030958,74.785234,Karnataka,"Mangaluru, Dakshina Kannada, 574146"
Austral Group S.A.A.,Peru,Av. Villa Del Mar S/N (Km. 439),-9.0219,-78.6209,Áncash,Puerto Huarmey
Indo Fish Meal & Oil Company Private Limited,India,"Door No. 1-1/11, Kotepura Beach Rd",12.834017,74.833034,Karnataka,"Ullal, Dakshina Kannada, 575020"
"INDAH KEMILAU ALAM NUSANTARA, CV",Indonesia,"Jl. Jongor Komp. Ppp Jongor Blok B1 No. 17 Dan 18 Kel. Tegalsari, Kec. Tegal Barat, 52111 Jawa Tengah",,,,
Industri Tepung,Indonesia,"JFGC+99R, Jl. Polda Sabari, Manderan II, Puger Kulon, Kec. Puger, Kabupaten Jember, Jawa Timur 68164, Indonesia",-8.37393,113.47082,,
J.M. Sea Foods,India,"Plot No. 315, 316",20.90445,70.39492,Gujarat,"Veraval, Gir Somnath, 362269"
Jaimar Enterprises,India,"5/388, Kovankadu Main Rd",8.692379927,78.09382309,Tamil Nadu,"Palayakkayal, Thoothukudi, 628152"
Janatha Fish Meal and Oil Products,India,Manoor Fisheries Rd,13.523805,74.695512,Karnataka,"Kota, Udupi, 576221"
Ayazım Yem,Turkey,MUSABEY MH. Menemen Maltepe Yolu SK. No: 60/1 MENEMEN -İZMİR,38.6263342,27.0332061,"İzmir, Aegean Region",35660 İzmir
Janatha Ocean Products,India,"Weigh Bridge Campus, 7/191 Irukkanthurai Post",8.208723,77.654258,Tamil Nadu,"Kudankulam, Tirunelveli, 627106"
Jenefa India,India,"Survey No. 764/1,2,3, Vadakku Karacheri Village",8.764907,77.924319,Tamil Nadu,"Srivaikundam, Thoothukudi, 628601"
King Fish Products,India,Bhalpara Part,20.90854,70.3944,Gujarat,"Somnath, Gir Somnath, 362265"
PT Lautan Kembar Sejati,Indonesia,"874X+V9 Purworejo, Rembang Regency, Central Java, Indonesia",-6.69249,111.29831,,
M/s Blueline Foods (India) Pvt. Ltd. Unit-II,India,"Door No. 1-312 Kambla Padav, Kurnad",12.813917,74.936007,Karnataka,"Bantwal, Dakshina Kannada, 574153"
Mangalore Marine Products,India,"Door No. 1-2-1-2, Sea Rd Kotepura",12.834551,74.833435,Karnataka,"Ullal, Dakshina Kannada, 575020"
"Marksmen Aquatic Products, LLP",India,"6/84, Vadakkukariseri",8.766840619,77.93230215,Tamil Nadu,"Vadakkukariseri, Thoothukudi, 628851"
Mulia abadi tepung ikan (Noble perennial fishmeal),Indonesia,"H84P+MQ Dusun Sampangan, Kedungrejo, Banyuwangi Regency, East Java, Indonesia",-8.44342,114.33687,,
Marksmen Marine Products Pvt Ltd,India,"Plot No. 188, Edayar Industrial Development Area, Binanipuram",10.077997,76.308328,Kerala,"Edayar, Ernakulam, 683502"
PT Munchar,Indonesia,"H86R+988, Dusun Sampangan, Kedungrejo, Kec. Muncar, Kabupaten Banyuwangi, Jawa Timur 68472, Indonesia",-8.43912,114.34062,,
Austral Group S.A.A.,Peru,Carr. Costanera N° 1861,-17.571086,-71.356345,Áncash,Puerto Huarmey
MM Ashraf LLP - Manufacturer of Fish Meal and Fish Oil,India,"Plot No: B-14/1, MIDC Mirjole, near Hotel Kanchan",17.001505,73.350506,Maharashtra,"Ratnagiri, Ratnagiri, 415639"
Austral Group S.A.A.,Peru,Av. Prolongaci N Roosevelt N° 1008,-11.5788,-77.2693,Áncash,Puerto Huarmey
Pabrik Tepung Ikan PPP Tegalsari (PPP Tegalsari Fish Meal Factory),Indonesia,"542G+3WW, Tegalsari, Tegal Barat, Tegal City, Central Java 52111, Indonesia",-6.84969,109.12724,,
PT. Bali Omega,Indonesia,"JHH8+6F Cupel, Jembrana Regency, Bali, Indonesia",-8.372022,114.566346,,
Mukka Proteins Limited,India,"Door No. 1-5(1), 1-1/17, 17(1) Kotepura",13.037,74.7874,Karnataka,"Ullal, Dakshina Kannada, 575020"
PT. CNL Maju Bersatu,Indonesia,"4MPQ+QH Panjang Wetan, Pekalongan City, Central Java, Indonesia",-6.862913,109.689053,,
Mukka Proteins Limited,India,"Plot No. 58, Javar Naka",21.651319,69.578141,Gujarat,"Javar Village, Porbandar, 360575"
Ud Samudra Kencana,Indonesia,"JH5H+XWP, Pengambengan, Negara, Jembrana Regency, Bali 82218, Indonesia",-8.390126,114.579818,,
Mukka Sea Food Industries Pvt Ltd,India,"Door No. 14-161 to 164, Sasihithlu Rd, Mukka",13.028752,74.78687,Karnataka,"Mangaluru, Dakshina Kannada, 575021"
Austral Group S.A.A.,Peru,Lot. Santa Elena De Paracas Mz. D Lt 1-6,-13.78910587,-76.24038318,Áncash,Puerto Huarmey
PT Sarifeed Indojaya,Indonesia,"H85R+79 Kedungrejo, Banyuwangi Regency, East Java, Indonesia",-8.4422,114.34101,,
NatNov Bioscience Pvt. Ltd.,India,"Bhagatpur, Khantapda",21.409075,86.831513,Odisha,"Balasore, Balasore, 756043"
PT Pahala Bahari Nusantara,Indonesia,"M4FX+VJF, Pasirsari, Cikarang Selatan, Bekasi Regency, West Java 17530, Indonesia",-6.3249,107.1494,,
NPM Aquatic Fish Links Private Limited,India,Near Kadangode Quarry,10.716096,76.132599,Kerala,"Vellatheri, Thrissur, 680604"
Om Sai Aqua,India,Santhavelur Village,13.702545,79.928511,Andhra Pradesh,"Kuvvakolli, Chittoor, 524121"
Industrias Barda SA de CV,Mexico,"Calle Isla de la Aduana sin número, Parque Industrial Fondeport Yavaros, Huatabampo, Sonora, México.",26.8472,-109.6328,Sonora,Huatabampo
Austral Group S.A.A.,Peru,Pampa Caliche S/N Km. 7.5 Pacocha,-17.571082,-71.356325,Áncash,Puerto Huarmey
Omega Fishmeal And Oil Private Limited,India,"Plot No. G-3, Mirjole Industrial Complex",17.0071,73.33874,Maharashtra,"Ratnagiri, Ratnagiri, 415639"
Pacific Marine Products,India,"Plot No. 1, R.S. No. 1763, Gujarat Industrial Complex",20.905628,70.396948,Gujarat,"Somnath, Gir Somnath, 362268"
Tepung Ikan Bangkit Jaya (Bangkit Jaya Fish Meal),Indonesia,"542J+3HX, Jl. Jongor, Tegalsari, Kec. Tegal Bar., Kota Tegal, Jawa Tengah 52111, Indonesia",-6.850137,109.131503,,
TEPUNG IKAN BYPASS KRIAN,Indonesia,"JH4R+H5 Sidomojo, Sidoarjo Regency, East Java, Indonesia",-7.39364,112.590436,,
Pearl City Marine Products Pvt. Ltd,India,"No. 193/2, 7, 8, Pallakulam Village",9.041476,78.251153,Tamil Nadu,"Ottapidaram, Thoothukudi, 628903"
Prime Bio Proteins,India,"Plot No. 610/1, Gujarat Industrial Complex",20.9027967,70.392642,Gujarat,"Veraval, Gir Somnath, 362269"
Tepung Ikan Manual Muncar (Muncar manual fish meal),Indonesia,"H86R+H5 Kedungrejo, Banyuwangi Regency, East Java, Indonesia",-8.438539,114.340478,,
TEPUNG IKAN MURNI BEKASI (BEKASI PURE FISH FLOUR),Indonesia,"P3Q4+QH Mekarsari, Bekasi Regency, West Java, Indonesia",-6.260578,107.056405,,
Tepung ikan/minyak ikan SBR (SBR fish meal/fish oil),Indonesia,"H82Q+F2 Kedungrejo, Banyuwangi Regency, East Java, Indonesia",-8.448792,114.337608,,
Progress Frozen and Fish Sterilization,India,"Survey No. 15/3, Jawar Naka",18.498703,73.9531515,Gujarat,"Porbandar, Porbandar, 360575"
PT. Sais Jaya Abadi,Indonesia,"JG48+78 Sumberrame, Gresik Regency, East Java, Indonesia",-7.394115,112.515846,,
Quality foods,India,"Plot No. Sb-39 & Sb-50a, Cuncolim Industrial Estate",15.18208,74.03192,Goa,"Cuncolim, South Goa, 403703"
Don Raul S.A.C.,Peru,"Av. Pardo N° 6125, Zona Industrial 27 De Octubre",-9.1159,-78.5367,Áncash,Samanco
Productora Amg S.A.C.,Peru,La Primavera 440 Sector La Huaca,-8.9864,-78.6129,Áncash,Santa
Pesquera Natalia S.A.C.,Peru,Zona Valle De Pescadores,-16.587,-72.7063,Arequipa,Camana
AFRIC AZOTE,Senegal,Avenue Félix Eboué Bel-air BP 909 Dakar,14.6984214,-17.4251288,Dakar,00000 Dakar
CV Bumi Indo,Indonesia,"Jl. Tirta Suam No. 1, Mergelo, Kedundung, Kec. Magersari, Kota Mojokerto, Jawa Timur 61312, Indonesia",-7.46674,112.46107,,
Pabrik Tepung Ikan,Indonesia,"6MVQ+PFJ, Kapitan River, Kumai, West Kotawaringin Regency, Central Kalimantan 74181, Indonesia",-2.75573,111.68871,,
PT Bumi Indo Jaya,Indonesia,"46M2+5J Kramat, Tegal Regency, Central Java, Indonesia // Jl. Raya Tegal - Pemalang No. KM, RW.7, Area Sawah/Kebun, Kramat, Kec. Kramat, Kabupaten Tegal, Jawa Tengah 52181, Indonesia",-6.8635,109.20145,,
PT Indocitra Jaya Sumadera,Indonesia,"Jl. Raya Pati - Juwana No. km 6, Pondohan, Purworejo, Kec. Pati, Kabupaten Pati, Jawa Tengah, Indonesia",-6.73349,111.09176,,
IQI BV,Netherlands,"De Mars 23, 7742 PT Coevorden, Netherlands",52.64437,6.733679,,Coevorden
San Fernando S.A.,Peru,Calle Alberto Briceño N° 217-219,-17.02366846,-72.01980721,Arequipa,Mollendo
Pesquera Hayduk S.A.,Peru,Av. Santa Marina S/N,-9.021,-78.6193,"Ascope,
La Libertad",Rázuri
BISNESMUN S.A.,Ecuador,"P775+XH, Ecuador",-2.293477,-80.737068,Guayas,Guayaquil
Borsea S.A.,Ecuador,KM 12 1/2 Via a Daule junto a Galapesca,-2.0940972,-79.9327278,Guayas,Guayaquil
Pesquera Hayduk S.A.,Peru,Caleta Végueta,-12.06143,-77.06987,"Ascope,
La Libertad",Rázuri
PESQUERA HAYDUK S.A.,Peru,Av. Simon Bolivar S/N,-12.091043,-76.973583,"Ascope,
La Libertad",Rázuri
Pesquera Hayduk S.A.,Peru,"Carretera Pisco, Paracas Km. 17, Lt. B De Lotizaci N Industrial De Santa Elena De Paracas",-13.80025019,-76.24401429,"Ascope,
La Libertad",Rázuri
Raj Fishmeal & Oil Company,India,"Door No. 1-23 B, 3rd Cross, Malpe-Madhwaraj Rd",13.3541,74.7027,Karnataka,"Malpe, Udupi, 576108"
PESQUERA HAYDUK S.A.,Peru,Caleta Végueta,-12.091043,-76.973583,"Ascope,
La Libertad",Rázuri
Pesquera Hayduk S.A.,Peru,Caleta Cata Cata S/N,-17.67822156,-71.36251604,"Ascope,
La Libertad",Rázuri
Pesquera Hayduk S.A.,Peru,Panamericana Norte Km. 163.4,-11.00067178,-77.64737739,"Ascope,
La Libertad",Rázuri
Kakariki Proteins Limited,New Zealand,"1567 Halcombe Road, Halcombe 4779, New Zealand",-40.1291,175.4458,Manawatū-Whanganui,Halcombe
Baysun Su Ürünleri,Turkey,"Karaağaç, 57662 Karaağaç/Dikmen/Sinop",41.6537964,35.3780205,"Sinop, Black Sea Region",57662 Sinop
Intermarket International,Pakistan,"F-16, Sector 50-C, Korangi, Karachi, Pakistan
Postal Address:
309/311, Business & Finance Centre, I.I. Chundrigar Road, Karachi, Pakistan",24.82471,67.17456,,Karachi
Pesquera Hayduk S.A.,Peru,"Av. Playa Norte S/N, Puerto Malabrigo",-7.683605982,-79.43371198,"Ascope,
La Libertad",Rázuri
Agouzzal & CIE S.A.,Morocco,Port d'Essaouira Quartier Industriel B.P. 41,31.5092,-9.7744,,
Compania Pesquera del Pacifico Centro S.A.,Peru,"Playa Norte, Calle 4/N",-7.68768789,-79.43334057,"Ascope, La Libertad",13730 Paiján
Tan Long Seafoods Company,Vietnam,"Tổ 27,ấp An Hải, xã Lộc An, huyện Đất Đỏ, Lộc An, Đất Đỏ, Bà Rịa - Vũng Tàu, Vietnam // F88P+GQ Đất Đỏ District, Ba Ria - Vung Tau, Vietnam",10.466537,107.336742,Bà Rịa-Vũng Tàu,Vung Tau
CORPORACION DE PROYECTOS MULTIPLES MULT .I. PROYECTOS S.A.,Ecuador,ZONA INDUSTRIAL CHANDUY S/N,-2.399837,-80.70089,Santa Elena Province,Chanduy
Tan Tien Fish Meal Processing Factory,Vietnam,"F88Q+64Q, Vũng Tàu - Bình Châu, Lộc An, Đất Đỏ, Bà Rịa - Vũng Tàu, Vietnam",10.465611,107.337759,Bà Rịa-Vũng Tàu,Vung Tau
Truong Phuc Seafood Co. Ltd.,Vietnam,Canh Dien Hamlet - Long Dien Tay Commune - Dong Hai District - Bac Lieu Province.,9.056941,105.406783,Bac Lieu,Dong Hai
Tecnológica de Alimentos S.A. (TASA),Peru,"Caleta Cata Cata, Altura Del Km. 4.5 De La Carretera Costanera Sur",-5.23487,-80.63835,"Barranca,
Lima",Supe
Corporacion De Proyectos Multiples Mult.I.Proyectos S.A.,Ecuador,CDLA. LOS OLIVOS 1 AV. LEOPOLDO CARRERA SOLAR 1 MZ 62 EDIF. OLIVOS TOWER PISO 6 OF 606 - ZONA INDUSTRIAL CHANDUY,-2.399748,-80.700941,,
Beşyem Tarım Hayvancılık Gıda Sanayi ve Ticaret A. Ş.Yem Fabrikası,Turkey,3.Organize Sanayi Bölgesi 83303 Nolu Cad. No: 9 Başpınar / Şehitkamil / GAZİANTEP,37.17636,37.32734,,
Pesquera Diamante S.A.,Peru,Km.15.5 De La Carretera Pisco,-5.074943,-81.0732879,"Barranca,
Lima",Supe
Tecnológica de Alimentos S.A. (TASA),Peru,Carretera Paracas Km 17.1,-13.79749532,-76.24304857,"Barranca,
Lima",Supe
Biomar Sagun Yem Sanayi Ticaret Anonim Şirketi Yem Fabrikası,Turkey,"BioMar-Sagun Yem San. ve Tic. A.Ş.
Söke OSB 1. Cadde No: 27
09200 Aydın
Türkiye",37.75762,27.44048,,
Tecnológica de Alimentos S.A. (TASA),Peru,Av. La Marina N° 369,-10.79525649,-77.74401681,"Barranca,
Lima",Supe
Pesquera Diamante S.A.,Peru,"Playa Norte Lt. 1B-1 y 1B-2, Puerto Malabrigo",-7.689618842,-79.43342304,"Barranca,
Lima",Supe
Shri Rozy Fish Meal and oil,India,Javar Naka,21.659283,69.570232,Gujarat,"Javar Village, Porbandar, 360579"
Siddhivinayak Fish Meal,India,"Plot No. G2, Taloja, Mirjole Industrial Complex",19.0901,73.12103,Maharashtra,"Panvel, Raigad, 410208"
Sonia Marine Exports Private Limited,India,"Mirjole Industrial Complex, Dongrepada",19.078642,73.141724,Maharashtra,"Panvel, Raigad, 410208"
Span Aquatic Products,India,Ullal Industrial Area,12.833264,74.833662,Karnataka,"Ullal, Dakshina Kannada, 575020"
The Waterbase,India,Ananthapuram Village,14.354811,80.139414,Andhra Pradesh,"Ananthapuram, Nellore, 524344"
Tirupati Fish Meal,India,Near Bharat Petroleum,20.889743,71.384802,Gujarat,"Jafarabad, Amreli, 365540"
TJ Marine Products Pvt Ltd,India,"Plot No. B-27/28, Mirjole Industrial Complex",17.003585,73.349969,Maharashtra,"Ratnagiri, Ratnagiri, 415639"
Ullal Fish Meal And Oil Company,India,"Door No. 1-19-1, Sea Rd, Kotepura",12.832987,74.834118,Karnataka,"Ullal, Dakshina Kannada, 575020"
United Marine Products,India,"Plot No. L-28, Cuncolim Industrial Estate",15.18172,74.029563,Goa,"Cuncolim, South Goa, 403703"
"United Marine Products, Ullal plant",India,Ullal Industrial Area,12.8391447,74.831888,Karnataka,"Ullal, Dakshina Kannada, 575020"
Sandhya Marines Ltd.,India,"National Highway 214, Poolapalli Village",16.525081,81.704166,Andhra Pradesh,"Palakollu, West Godavari, 534261"
Yashaswi Fish Meal and Fish Oil Company,India,Katipalla,12.98936,74.87409,Karnataka,"Mangaluru, Dakshina Kannada, 574142"
Htoo Htoo Toe International Company Limited,Myanmar,"Inlay Myaing Industrial Zone South Myeik Qr,Myeik Township Tanintharyi Region.",12.45725,98.62166,,#REF!
Yashaswi Fish Meal and Fish Oil Company,India,"9-184B, Fishing Industrial Area, Post Pithrody",13.2903,74.73054,Karnataka,"Udyavara, Udupi, 574118"
Shree Ulka LLP,India,,13.000239,74.858251,,
Growel Feeds Pvt Ltd,India,"R.S. No.  57, Chevuru Village, Sriharipuram, Panchayat, Mudinepalli, Singarayapalem, Andhra Pradesh 521329, India",16.4233527,81.1583052,,
Çamlı Yem Besicilik San. ve Tic. A.Ş.,Turkey,Selvilitepe OSB Mah. 1453 Cad. No:7 Organize Sanayi Bölgesi 45400 Turgutlu/ Manisa,38.48888,27.64384,,
Godrej Agrovet Limited - Hanuman Junction Plant,India,"Krishna Kaanumolu, Hanuman Junction, Andhra Pradesh 521106, India",16.5869507,80.9681112,Andhra Pradesh,
Gurunathan Aqua Products,India,near Sri isakki amman temple,8.31946,77.92051,Tamil Nadu,"Radhapuram, Tirunelveli, 627651"
Hiravati Marine Products Pvt Ltd,India,"Jawar Naka, Subhashnagar",21.649153,69.578082,Gujarat,"Javar Village, Porbandar, 360575"
Can Kardeşler Su Ürünleri San. Tic. A.Ş. Yem İşletmesi,Turkey,Karaağaç Köyü Güzelceçay Mevkii Dikmen,41.001926,39.73921,"Sinop,
Black Sea Region",57000 Sinop
NPM Fish Meal and Oil Products,India,"NH 138, Pottalurani",8.733185,77.93705,Tamil Nadu,"Ellainayakkanpatti, Thoothukudi, 628851"
Kanpa International Sales.,Pakistan,"15-A / 16A, Deh Ibrahim Hyderi, Korangi Creek, Karachi, Pakistan Postal Address:D-3/D-4, Fish Harbour, West Wharf, Karachi, Pakistan",24.80596,67.1071,,Karachi
Rehoboth Fish Meal & Oil Plant,India,Rehoboth Fish Meal & Oil Plant Rd.,9.099652,78.32345,Tamil Nadu,"Vilathikulam, Thoothukudi, 628851"
Aliment et Proteine Du Nord,Morocco,"Km 24, Route de Tétouan Fahs El Anjra, Tangier, Morocco",35.61100814,-5.664605241,,
Corporacion De Proyectos Multiples Mult.I.Proyectos S.A.,Ecuador,"SITIO COMUNA EL REAL, PARROQUIA CHANDUY, CANTÓN SANTA ELENA, PROVINCIA SANTA ELENA.",-2.399735,-80.700857,,
Almeve SARL,Morocco,Route du Jorf El Youdi B.P. 74,32.25876365,-9.259691606,,
FASA,Brazil,"R. João Eckert, 1000, Cruzeiro do Sul - RS, 95930-000, Brazil",-29.5099,-52.0675,Rio Grande do Sul,Cruzeiro do Sul
Tecnológica de Alimentos S.A. (TASA),Peru,Km.15 Carretera Pisco-Paracas,-16.22865648,-73.60944495,"Barranca,
Lima",Supe
Alpha Atlantic De Sahara Marocaine SA,Morocco,Zone Industrielle,27.9283,-12.9332,Laâyoune-Sakia El Hamra,Tarfaya
M.A. Proteins,Pakistan,"Plot # 121, Sector # 7/A. Korangi Industrial Area, Karachi, Pakistan
Postal Address:
Plot # 19, Sector # 16, Korangi Industrial Area, Karachi, Pakistan",24.84266,67.1544,,Karachi
Tecnológica de Alimentos S.A. (TASA),Peru,Pasaje Santa Rosa N° S/N A.H. Miraflores Alto,-13.78401321,-76.23962007,"Barranca,
Lima",Supe
Can.Kardeşler Su Ürün.San.Ve Tic.A.Ş. Bal.Un.Fab.,Turkey,,41.083257,39.377095,Trabzon,Çarşıbaşı
M/S. Shamsi Industries.,Pakistan,"C-20, IBRAHIM HYDARI, INDUSTRIAL AREA, KORANGI CREEK KARACHI-PAKISTAN",24.80596,67.1071,,Karachi
Harina de Pescado PINDHAGON,Ecuador,AV. PRINCIPAL S/N STA ELENA - COLONCHE,-2.0481,-80.715,,
Narciso Dias & Filhos,Portugal,"9J3M+7X Peniche, Portugal",39.3532,-9.3651,Leiria District,Peniche
Deltagen Ecuador S.A.,Ecuador,km 4 1/2 Sierra Hermosa el Arenal lote 3 y Panamericana norte,-0.1092,-78.4517,,
"Dalyan Su Urunleri ve Gida San. Nak. Tic. Ltd. Sti. (KOBYALAR
GROUP)",Turkey,"Güzelceçay Mevkii Karağaç Dikmen,",41.677576,35.392971,"Sinop,
Black Sea Region",57000 Sinop
DESPROCAR,Ecuador,Santa Rosa,-79.9792083,-3.4405583,,
DIBAR S.A.,Ecuador,"Calle principal, comuna El Real",-80.711625,-2.3921694,,
Dimolfin SA,Ecuador,"R6XR+WM8, San Pablo, Ecuador",-2.1499,-80.7585,Santa Elena Province,240209 Salinas
ECUAFEED S.A.,Ecuador,"PROVINCIA DE SANTA ELENA, CANTÓN SANTA ELENA, PARROQUIA COLONCHE, BARRIO VIRGEN DEL ROSARIO DE LA COMUNA JAMBELÍ, SECTOR LAS PALMAS",-2.046863,-80.714591,,
BEL MEAL,Senegal,Zone Industrielle de Sandiara,14.425794,-16.813539,Thiès Region,23000 Sandiara
Empresa Pesquera Polar S.A.,Ecuador,"Salango Puerto López, Manabí",-1.596319,-80.846835,Manabí,130315 Salango
Exu SA,Ecuador,"J74Q+W5 El Real, Ecuador",-2.3927,-80.712,Santa Elena,El Real
