Company name,Country,Site address,Latitude,Longitude,Province,City
Choke Udom Pattana Fishmeal Limited Partnership,Thailand,"10/4 Moo 2,Tambon Bangmuang, Amphoe Takuapa, Phang-Nga 82190, Thailand",8.47557,98.52672,Phangnga Province,Amphur Takuapa
"Mit Khanom Fish Meal (1997) Co., Ltd.",Thailand,8/1 m.13 Thung Prang,9.005773,99.923241,Nakhon Si Thammarat,Sichon
"Witchu Industry Co., Ltd.",Thailand,1/1 m.13 Thung Prang,9.006394,99.900955,Nakhon Si Thammarat,Sichon
"Sichon Fishmeal Factory Part., Ltd.",Thailand,"519 m.1, Thung Sai",9.0178,99.9131,Nakhon Si Thammarat,Sichon
"Chaweng Watana Fishmeal Factory Part., Ltd.",Thailand,"359 m.1, Pak Nakhon Rd.",9.1093084,99.2485584,Nakhon Si Thammarat,Mueang
Orizon S.A.,Chile,"AV PEDRO AGUIRRE
CERDA 719 LO ROJAS
CORONEL REGION
DEL BIOBIO",-36.7693,-73.1125,Bío Bío,Talcahuano/Coronel
Malayan Fish Oil Sdn Bhd,Malaysia,"JALAN FZ8-P3 PKFZ /KS 12, 42920 Pulau Indah, Selangor, Malaysia",2.9022,101.2947,Selangor,Pulau Indah
Orizon S.A.,Chile,ARTURO GODOY S N PLAYA BLANCA GUAYACAN PAMPILLA PARTE ALTA COQUIMBO REGION DE COQUIMBO,-29.9632,-71.3605,Bío Bío,Talcahuano/Coronel
QL Endau Marine Products Sdn. Bhd.,Malaysia,"No. 11, Jalan Merlimau,86900
Endau,Johor",2.6551,103.625,Johor,Endau
Tak Chua Brothers Sdn Bhd,Malaysia,"Lot 120, Jalan Tepi Sungai, 36400, Hutan Melintang, Perak, Malaysia",3.871105177,100.9248628,Perak,Hutan Melintang
CORPESCA S A,Chile,AV ARTURO PRAT 93,-20.20466138,-70.14222523,"Provincia de Iquique,
Tarapacá Region",Iquique
"Hyundai Special Feed IND Co., LTD.",South Korea,"19-5 Mojeon-ri, Gangdong-myeon, Gangneung, Gangwon-do, South Korea",37.7083,128.9866,Gangwon-do,Gangneung
Ard mahi khazar,Iran,"9W8W+QQH, Deh Sar, Gilan Province, Iran",37.3669,49.947,Gilan Province,Deh Sar
Industrial del Pacifico S.A de C.V.,Mexico,"Alvaro Obregón 72, Yavaros, 85252 Yavaros, Son., Mexico",26.7049,-109.5109,Sonora,Yavaros
BLUMAR S A,Chile,"Av. Carlos Prats 60, Coronel, Bío Bío, Chile",-37.02516856,-73.15069925,"Provincia de Concepción,
Biobío Region",Coronel
Alimentos Pesqueros SpA,Chile,"Pedro Aguirre Cerda 639, Coronel, Bío Bío, Chile",-37.0225,-73.1612,Bío Bío,Coronel
QL Fishmeal Sdn. Bhd.,Malaysia,"Lot 164, 2647 & 3314, Jalan Tepi Sungai, 36400, Hutan Melintang, Perak",3.8722,100.9444,Perak,Hutan Melintang
Alimentos Pesqueros SpA,Chile,"Av. Pedro Aguirre Cerda Nº 639, Lo Rojas - Coronel. Chile",-37.02204,-73.16041,Bío Bío,Coronel
Maz Industrial SA de CV,Mexico,"V4QJ+54 Guaymas, Sonora, Mexico",27.8879,-110.8697,Sinaloa,82000 Mazatlán
Pacifico Industrial S.A. de C.V.,Mexico,"Alvaro Obregón 72, Yavaros, 83224 Yavaros, Son., Mexico / Parque Fondeport S/N, Localidad de Yavaros, C.P. 85252, Huatabampo, Sonora",26.7059,-109.5148,Sonora,Yavaros
Sandakan Fishmeal Sdn. Bhd.,Malaysia,"Mile 6, Batu Sapi Road, P.P.M.681, 90000 Sandakan, Sabah, Malaysia",5.8059,118.0541,Sabah,Sandakan
Industria Procesadora de Aceites y Grasas S.A.,Chile,"Calle E, lote 17-A-1, Parque Industrial Escuadrón, Coronel. Chile",-36.97598,-73.17365,,
"Woojin Feed Co., Ltd",South Korea,"178-30 Gajwa-dong, Seo-gu, Incheon, South Korea",37.4912,126.6564,,#REF!
"Chok Anavin Fishery Co., Ltd.",Thailand,"91 m.8, Thong Nian",9.2247226,99.8586182,Nakhon Si Thammarat,Khanom
"Panichprapon Co., Ltd.",Thailand,86/6 m.8 Tong Nean,9.2258,99.8547,Nakhon Si Thammarat,Khanom
"Charoensinwaree Co., Ltd.",Thailand,5 Phornutthaphon Fish Market 9,9.2292,98.3767,Phang Nga,Khura Buri
Kantang KSC Part. Ltd.,Thailand,1 m.3 Hrura,9.237069,98.393879,Phang Nga,Krura Buri
Charoen Kijjakarn Ranong Fish Meal Factory Part. Ltd.,Thailand,"19 m.2, Phetkasem Rd., Ratchakrut",9.7471,98.5857,Ranong,Mueang Ranong
"Siamchai Pokpan Co., Ltd",Thailand,"73/3 M.2
Petkasem Road,
Bangrin, Muang,
Ranong 85000
Thailand",9.92732,98.63191,Ranong,Mueang Ranong
"Mahatasinwaree Co., Ltd.",Thailand,"95/16 m.1, Saphan Pla Rd., Paknam",9.936913432,98.59241474,Ranong,Mueang Ranong
"Saha Pramong Fish Meal Ranong Co., Ltd.",Thailand,"303/4-5 m.5 Nok Khao Alley, Bang Rin",9.95527,98.609679,Ranong,Mueang Ranong
"Teppama Fishmeal Co., Ltd",Thailand,71/7 Pak Nam Road,9.9783,98.6106,Ranong,Mueang Ranong
"Suk Ruang Kaew Fish Meal (2004) Co., Ltd.",Thailand,"59/1 m.2, Bang Non",9.9833,98.6211,Ranong,Mueang Ranong
Ranong Food Products Part. Ltd.,Thailand,"133/2 m. 5, Pak Nam",10.0244,98.6206,Ranong,Mueang Ranong
"Krungdhep Mahakij Co., Ltd.",Thailand,"67/1 Moo 5, Tambon Pak-Nam, Amphur Muang Ranong, Ranong 85000 Thailand",10.05203,98.63761,Ranong,Mueang Ranong
Teppama Fishmeal Company Limited,Thailand,"71/7 Moo5,Tambon Paknam,Amphoe Mueng,Ranong Provine Thailand 85000",10.28167,98.75726,,#REF!
"Tungka Fishmeal
Part.,Ltd.",Thailand,"197 Moo.5, Tumbol
Tungka, Amphoe Mueang, Chumphon 86100, Thailand",10.377366,99.122845,,#REF!
"Siam Fishmeal Factory Co., Ltd. (Part. Ltd.)",Thailand,"174-175 m.8, Pak Nam",10.4341889,99.23856213,Chumphon,Mueang Chumphon
"Klong Yai Fishmeal Co., Ltd.",Thailand,"36 m.1, Khlong Yai",11.774941,102.881698,Trat,Khlong Yai
"Wasan Samut Fish Meal Part., Ltd.",Thailand,"57/3, m. 4, Khlong Yai",12.1853,102.38,Trat,Laem Ngop
"Saengcharoen Products part., Ltd.",Thailand,"99/9 m.1 Cholpratan Rd., Wangkrajae",12.212654,102.496979,Trat,Mueang Trat
"San-nguansin Fish Meal Part., Ltd.",Thailand,61 m.4 Ko Proet,12.4084,102.1261,Chanthaburi,Laem Sing
"Ban Klaeng Industry Part., Ltd.",Thailand,97/1 m.6 Klaeng,12.634697,101.499931,Rayong,Mueang Rayong
"Eastern Fishmeal Co.,Ltd.",Thailand,"49/1 Moo6, Mueang Rayong District, Rayong Province 21160",12.643982,101.453738,,#REF!
Sürsan Su Ürünleri San. ve Tic. A.Ş. Yem Fabrikası,Turkey,"Bankalar Cad. Ferah Sok. No:5
Samsun - Türkiye",37.23825,27.64809,,
Sürsan Su Ürünleri Sanayi ve Ticaret A.Ş. Balık Unu Fabrikası,Turkey,Karaağaç Köyü Dip Mevkii,41.641979,35.492498,"Sinop,
Black Sea Region",Dikmen
Uğurlu Balık Üretim Sanayi ve Ticaret A.Ş. Yem Fabrikası,Turkey,Fevzipasa Mah. Cumhuriyet Cad. No: 346/40 Didim 09270 Aydın / Türkiye,37.43578,27.36273,,
Unifeed Su Ürünleri Yem Sanayi ve Ticaret Anonim Şirketi,Turkey,Subaşı Mah. 229 Sok. No:26/1 Merkez,38.1010761,27.4181455,"Izmir,
Aegean Region",Torbalı
Sté Marocaine de Traitement de Poisson Sud (Somatraps)  S.A.R.L.,Western Sahara,Saad Zone Industrielle B.P. 71,27.07860415,-13.41689191,Laayoune Province,El Marsa
Ste de Traitement et de Congelation de Poissons (SOTRAGEL),Western Sahara,Lot 53 Zone Industrielle,27.07854593,-13.41527515,Lot 53 Zone Industrielle,El Marsa
Afropesca,Western Sahara,Saad Zone Industrielle,27.0567,-13.4225,,
Atlantic Tank Terminal,Western Sahara,"Lot 89, Zone Industrielle, El Marsa, Laayoune, Western Sahara",27.0414,-13.4328,Laayoune Province,El Marsa
Copelit,Western Sahara,Saad Zone Industrielle,27.0958,-13.4255,Laayoune Province,El Marsa
CPD FARINE,Western Sahara,Lot 2 Zone Industrielle,23.68859362,-15.95246182,Dakhla - Oued Ed-Dahab,Dakhla
Damsa SA,Western Sahara,"Lot A 59, Zone Industrielle Laâyoune, El Marsa, Laâyoune, Western Sahara",27.0756,-13.4136,Laayoune Province,El Marsa
DELTA OCEAN,Western Sahara,Saad Zone Industrielle B.P. 16,27.07679369,-13.41713894,Laayoune Province,El Marsa
Global Fish Trading Sarl,Western Sahara,Avenue 21 Number 21 Hay El Fath,27.0959,-13.4255,Laayoune Province,El Marsa
K.B. Fish,Western Sahara,Zone Industrielle,27.0957572,-13.42522856,Laayoune Province,Laayoune
Laayoune Elevage,Western Sahara,Saad Zone Industrielle B.P. 13,27.0764,-13.4161,,
Laayoune Proteins S.A.R.L.,Western Sahara,Zone Industrielle,27.0957572,-13.42522856,Laayoune Province,Laayoune
"Thai Luxe Enterprises PCL, Thailand",Thailand,"62 m.2, Nong Chumphon",13.2878,99.8022,Phetchaburi,Khao Yoi
Ban Bueng Plapon Co Ltd,Thailand,"165/2 m.2 Ban Bueng – Nong Bon Daeng St., Nong Bon Daeng",13.35,101.1583,Chon Buri,Ban Bueng
"Panus Feed Mill Co., Ltd.",Thailand,"888 m.7, Tha Bunmee",13.3947,101.3858,Chonburi,Ko Chan
Omicron Dephaa S.L.,Spain,"C. la Folia, 38639, Santa Cruz de Tenerife, Spain; 394P+H8 Ten-Bel, Spain",28.056496,-16.614208,Santa Cruz de Tenerife,Santa Cruz
Vital Seafood AS,Norway,"Kyrkjegata 57, 6200 STRANDA",62.3131,6.9455,Møre og Romsdal,Stranda
Productos Pesqueros de Guaymas,Mexico,"Lote 5 Manzana B, Colonia Parque Industrial Pesquero Rodolfo Sánchez Taboada, C.P. 85460, Guaymas, Sonora, México.",27.8825,-110.8709,Baja California,Guaymas
Productos Pesqueros de Guaymas,Mexico,"5VXH+26 Puerto Adolfo López Mateos, B.C.S., Mexico",25.1975,-112.1217,Baja California,Guaymas
Productos Pesqueros de Guaymas,Mexico,"Puerto Vallarta 75, Polígono Núm. 1, 23740 Puerto San Carlos, B.C.S., Mexico",27.881914,-110.870897,Baja California,Guaymas
"Nikko Oil & Fat Co., Ltd.",Japan,"1-87 Higashikaiganchō, Amagasaki, Hyogo 660-0843",34.69776545,135.4061412,,#REF!
Sanki Shiryo Kogyo Ltd.,Japan,"3-13-9 Matsue, Soka City, Saitama Prefecture; 340-0013",35.83703872,139.8106117,,#REF!
"Fishmeal Marketing Development Co., Ltd.",Thailand,"52 Moo 6, Praram 2 Rd., Km 72 Tambol Klorngkhon, Amphur Muang, Samut Songkram 75000, Thailand",13.411654,100.025572,,#REF!
"Taweelarp Fish Meal Part., Ltd.",Thailand,"61 Kittikhun Rd., Kantang",13.4608,100.0983,Trang,Kantang
SIAM PROTEINS COMPANY LIMITED,Thailand,"2/8 m. 5, Bang Torad",13.49387584,100.1677144,Samut Sakhon,Mueang Samut Sakhon
"Klongdan Fish Meal (2530) Co., Ltd.",Thailand,"207 m.6, Wat Sang Sok Alley, Sukhumvit Road, Khlong Dan",13.5047,100.8172,Samut Prakan,Bang Bo District
Thai Union Feedmill PCL.,Thailand,"89/1 m.2 Rama II Rd, Kalong",13.5072,100.1328,Samut Sakhon,Mueang Samut Sakhon
Asian Alliance International Co. Ltd.,Thailand,"8/9 Moo.3, Rama 2 Road, Banbor, Muang, Samutsakhon, 74000, Thailand",13.5189,100.1721,Samut Sakhon,Samutsakorn
"SIAM PRECIOUS FEEDS CO., LTD.",Thailand,"5/7 MOO 3, TAMBOL BANG THO RAT, AMPHOE MUEANG, SAMUT SAKHON 74000",13.521709,100.138465,Samut Sakhon,Amphoe Muang
Nutritech Co. Ltd.,Thailand,"68/7 Moo.8, Bangkrachao, Mueang Samut Sakhon, Samut Sakhon 74000, Thailand",13.5371,100.2017,Samut Sakhon,Samutsakorn
"Aquabest Group Co., Ltd.",Thailand,"45/6 m.9, Bang Krachao",13.5372,100.2011,Samut Sakhon,Mueang Samut Sakhon
TC Union Agrotech Co. Ltd.,Thailand,"68 Moo.8 Rama 2 Road, Bang krachao, Mueang Samut Sakhon, Samut Sakhon 74000 Thailand",13.5373,100.2015,Samut Sakhon,Samutsakorn
"Rungsin Pokphand Co., Ltd.",Thailand,"71 m. 8, Rama 2 Road, Bangkrachao",13.5383,100.2008,Samut Sakhon,", Mueang Samut Sakhon"
SPF Diana (Thailand) Co. Ltd,Thailand,"68/5 Moo.8 Bangkrachao, Muangsamutsakhon, Samutsakhon Province 74000 Thailand",13.5386,100.2019,,#REF!
"T.C. Union Agrotech Co., Ltd",Thailand,"Factory :
68 Moo8, Bangkrachao,
Mueang, Samutsakorn
74000 Thailand",13.54123,100.23496,,#REF!
Golden Prize Canning Co. Ltd.,Thailand,"55/4 Moo 3, Kok-Kham Road, Bangyapreak, Muang, Samuthsakron, 74000, Thailand",13.5442,100.285,Chang Wat Samut Sakhon,Samutsakorn
"Starfish Co.,Ltd.",Thailand,"79/26 Moo1 Bangtorud
Amphor Muang
Samutsakhon 74000
Thailand",13.544866,100.273828,,#REF!
Siirisaengarumpee Company Limited,Thailand,"69/16, Lane/Alley: Wat Sri Maeng, Setthakit 1 Road, Tha-Sai, Mueng Samut Sakhon, Samut Sakhon Province 74000 Thailand",13.54925,100.273625,,#REF!
"Piyo Bhokabhan Co.,Ltd",Thailand,"88 Mu 8, Wat Pak Bo Road, Bang Krachao, Mueang Samut Sakhon, Samut Sakhon, 74000, Thailand",13.5516,100.1948,Chang Wat Samut Sakhon,Samutsakorn
"Thachin Fishmill Industrial Co., Ltd.",Thailand,"57 m.5, Rama 2 Road, Tha Sai",13.5528,100.2456,Samut Sakhon,Mueang Samut Sakhon
Anusorn Mahachai Surimi,Thailand,"59/7 Moo8, Tambol Tasai, Amphur Muang , Samut Sakorn Provine 74000, Thailand",13.55362,100.23357,,#REF!
"Patthriya Thanit Co., Ltd.",Thailand,"194/49, Doembang, Mahachai",13.55898685,100.298202,Samut Sakhon,Mueang Samut Sakhon
Apitoon Fish Meal Company Limited,Thailand,"5/3 Moo 5, Tambon Thasai,
Amphur Muang
Samutsakhon,
74000 Thaii.And",13.565555,100.222005,,#REF!
Thai Union Ingredients Co. Ltd.,Thailand,"Site 30/24, Moo 8, Rama 2 Road, Tarsrai Sub-district, Mueang Samut Sakhon District, Samut Sakhon, Thailand, 74000 // HQ 979/33-44, 17th Floor, S.M. Tower, Phaholyothin Road, Phayathai Sub-district, Phayathai District, Bangkok 10400, Thailand",13.571,100.279,Tunis Governorate,Samutsakorn
Sirisaeng Arumpee Co. Ltd.,Thailand,"69/16 Mu.3,Soi Wat Si Mueang,Setthakit 1 Road,Tha Sai Sup-District,Mueang Samut Sakhon District,Samut Sakhon,Thailand, 74000",13.5713,100.2429,Phichit,Samutsakorn
"SR Biomarine Co., Ltd.",Thailand,"69/16 m.3, Wat Alley, Tha Sai",13.579167,100.244797,Samut Sakhon,Mueang Samut Sakhon
South East Asian Packaging and Canning Ltd. (SEAPAC),Thailand,"1 Moo. 4 Baanplaiklongkru Rd.,Nadee, Muang, Samutsakorn 74000, Thailand",13.5809,100.2867,Chang Wat Samut Sakhon,Samutsakorn
"Sucobma Co., Ltd.",Thailand,"229/9 Soi Suksawat 78 Alley, Suksawat Rd., Samrong Tai",13.5942,100.524883,Samut Prakan,Phra Pradaeng
Nivat Fishmeal Industry Company Limited,Thailand,"62/1, Village No.  1, Ekachai Road, Thajean Sub-District, Mueang Samut Sakhon District, Samut Sakhon 74000 Thailand",13.626521,100.35819,Samut Sakhon,Amphur Muang
"Sermsin Fish Product Co., Ltd",Thailand,"69/29 Vichien Chodok Road Moo 1, Tambon Thacheen, Amphur Mueng,
Samut Sakorn Province Thailand 74000",13.64552,100.52689,,#REF!
"Chareon Sin Fish Meal Co., Ltd.",Thailand,139/132 m.3  Khura,13.6508,101.2325,Phang Nga,Khura Buri
"Betagro Feed Mill Co., Ltd.",Thailand,"1 Yukon 2 Rd., Wat Thepsirin",13.6656,100.5453,Bangkok,Pom Prap Sattru Phai
"TSDP (Thailand) Co., Ltd.",Thailand,"60/6,7,8,9m.8 Om Noi",13.68601,100.28919,Samut Sakhon,Krathum Baen
"S.K.S. Agro-Marine Co., Ltd.",Thailand,"3425 Wat Inthabanjong Alley, Rama III Rd., Bang Kho Laem",13.690273,100.49957,Bangkok,Bang Kho Laem
Biomar Pargua,Chile,"Ruta 5 sur Km 1076, Pargua",-41.778723,-73.425492,"Provincia de Llanquihue,
Los Lagos Region",Bahía Pargua
United Fishing Enterprises Pty Limited,Namibia,Erf 1239 2nd St East Walvis Bay Namibia,-22.93059157,14.52093268,,#REF!
FoodCorp Chile S.A.,Chile,"Pedro Aguirre Cerda 1014, 4200570 Coronel, Bío Bío, Chile",-37.0228,-73.1665,Bío Bío,Coronel
Foodcorp Chile S.A.,Chile,"Avda Pedro Aguirre Cerda 995, Lo Rojas, Coronel, Chile",-37.02431,-73.16526,Bío Bío,Coronel
Golden Omega SA,Chile,"Av. Cmdte. San Martín 3460, Arica, Arica y Parinacota, Chile",-18.5038,-70.318,Arica y Parinacota,Arica
Biomar Castro,Chile,"W-55 174, Castro, Los Lagos, Chile",-42.4217,-73.7481,"Provincia de Chiloé,
Los Lagos Region",Putemún
Salmonoil S.A.,Chile,Sector La Campana s/n- Calbuco. Chile,-41.66590369,-73.19611913,"Provincia de Llanquihue,
Los Lagos Region",Calbuco
Mar Fusion S.A.,Chile,"CALLE D MANZANA D SITIO 26 PARQUE INDUSTRIAL ESCUADRON II
CORONEL
REGION DEL BIOBIO",-36.93686,-73.1556,,
Trio SpA,Chile,"Av Esquina Blanca 1117, Maipu, Santiago, Chile",-33.5118,-70.73133,Región Metropolitana,Maipú
Lota Protein SA,Chile,"AV MATTA ESQUINA
VILLAGRAN S N LOTA
REGION DEL BIOBIO
CHILE",-37.0984,-73.1565,Bío Bío,Concepcion
Yong Liang Fishmeal Sdn Bhd,Malaysia,"Taman Sekinchan Jaya, 45400 Sekinchan, Selangor, Malaysia",3.499862885,101.1062994,Selangor,Sekinchan
Hup Lean Alk Feedmeal Sdn. Bhd.,Malaysia,"Lot 872, Jalan Tepi Sungai, Hutan Melintang, Perak, 36400, Malaysia",3.870651275,100.9221558,Perak,Hutan Melintang
Star Feedmills (M) Sdn Bhd,Malaysia,x,2.891939517,101.8611933,Selangor,Beranang
Amazing Desire Sdn Bhd.,Malaysia,"12 km, Jalan Kunak-Semporna, P.O. Box 371, 91207, Kunak, Sabah",2.955926,101.823822,Sabah,Kunak
Sin Hong Heng Fishmeal Sdn. Bhd.,Malaysia,"No.  11, Jalan Merlimau, 86900, Endau, Johor, Malaysia",2.65510711,103.6250453,Johor,Endau
Guan Hoe Huat Fishmeal Co. Sdn. Bhd.,Malaysia,"Km 6, Jalan Menumbok, Kampung Paringan, Sabah, 89740 Kuala Penyu, Malaysia",5.493172,115.549712,Sabah,Kota Kinabalu
Yew Seng Fishmeal Sdn. Bhd.,Malaysia,"Pelabuhan Tawau, 91000 Tawau, Sabah, Malaysia",4.245469,117.879851,Sabah,Tawau
Lucky Ocean Enterprise Sdn. Bhd.,Malaysia,"7 km, Jalan Pangi, 91209 Kunak, Sabah, Malaysia",4.657862458,118.2762061,Sabah,Kunak
Sahamitr Fish Meal Company Limited,Thailand,"20 Moo.4 Satarana Road, Tambon Tha Chin, Amphoe Mueang Samut Sakhon, Samut Sakhon 74000 Thailand",13.71192,100.32144,,#REF!
Pesca Chile S.A,Chile,"Av. Pdte. Manuel Bulnes 5075, 6210023 Punta Arenas, Magallanes y la Antártica Chilena, Chile",-53.125,-70.8697,Magallanes y la Antártica Chilena,Punta Arenas
"Wiboon Agri Supply Co., Ltd.",Thailand,"17/1 m.10, Nong Pak Long",13.9044,99.9553,Nakhon Pathom,Mueang
"Sorasak Fishmeal Co., Ltd.",Thailand,"1111m.1 Don Phuttha, Don Tum",13.935124,100.118117,Nakhon Pathom,Don Tum
SPA International Food Group Co. Ltd.,Thailand,"20/1, MOO 9 SAM-NGAM, Don Tum, Nakhon Pathom, ตำบล สามง่าม อำเภอดอนตูม นครปฐม 73150, Thailand",13.9581,100.1129,Chang Wat Songkhla,Tambon Ban Phru
"Sang Thong Saha Farm (STF) Co., Ltd.",Thailand,"43/2 m.1, Tha Yang",14.2803,101.0506,Chumphon,Mueang Chumphon
"Rakyom 2525 Co., Ltd.",Thailand,"390/12 Moo 13, Watsai",15.72215654,100.1330206,Nakhon Sawan,Muang Nakhon Sawan
INVE (THAILAND) LTD.,Thailand,"Nakhonsawan-Phitsanulok Rd, Nong Lum, Wachirabarami, Pichit 66220",16.835023,100.272421,Phichit Province,Wachirabarami
"T R F Fishmeal Co., Ltd.",Thailand,"305 Mu 8 Paknum Chumporn Rd., Tambon Paknum, Amphur Mueang, Chumporn 86120, Thailand.",18.81053,98.99631,,
National Fish Canning and Packing Factory (NAF),Yemen,"Al-Shihr, Dufayqah, International Main Street, Al-Shihr Hadhramaut, 8122 Yemen",14.77395967,49.63191922,,#REF!
Binsedoon For Fish and Marine Co.,Yemen,"Hdramout Near Al Nashama Hotel
Bara Al Seda Street
Al Shuher 0533
Hadramout Yemen",14.7742,49.6331,,Al Shuher
Al-Muhajer For Trading and Seafood Industry,Yemen,,,,,
Albahsani Bin Sadoon,Yemen,,,,,
The Arab Company for Canning and Packaging,Yemen,,,,,
"Oceans Fish Factory, Ltd.",Yemen,,,,,
Botin Globe Company,Yemen,,,,,
King Future Factory,Yemen,,,,,
Bin Saldoun Grinding Factory,Yemen,,,,,
Gulf Protein Factory,Yemen,,,,,
Arabian Peninsula Company for Marine Products,Yemen,,,,,
Al-Nawras Company,Yemen,,,,,
Tuna Factory for Fish Canning and Packaging,Yemen,,,,,
Saba’a Factory for Fish Products,Yemen,,,,,
Al-Ghoweizi Fish Canning Factory,Yemen,,,,,
ardmahikhazar,Iran,"M5H8+W79, Abbasabad, Mazandaran Province, Iran",36.679699,51.165722,Mazandaran,Abbasabad
Babolsar Fish Powder and Oil Production Cooperative,Iran,"Mazandaran Province, Babolsar, Felestin St, PJ5X+6W6 شرکت تعاونی مصرف ماهیان خاویاری استان مازندران, Iran",36.70808,52.64967,Mazandaran,Babolsar
Behdaneh Shomal,Iran,"Iran,Babolsar,Meyrood",36.725443,52.775894,Mazandaran,Mirud
Chilan Pishbin Fish Meal Production Factory,Iran,"Beris-e-kohne، چابهار، استان سیستان و بلوچستان،، 55F4+9QH, Iran",25.17348,61.1569,Sistan and Baluchestan,Beris
Fanavaran Darya Co Ltd,Iran,"Hormozgan Province, Bandar-e-Jask, Fanavarandarya, PX76+864, Iran",25.7133,57.96054,Hormozgan,Bandar-e-Jask
Fish Lantern / Lanternfish of Qeshm / Fanous Mahiyan Qeshm / فانوس ماهیان,Iran,"Hormozgan Province, Suzā، Unnamed Road، Q2JP+886, Iran",26.78068,56.03581,Hormozgan,Qeshm
Golden Clean Industry Qeshm Fish Meal Factory / Zarin Sanat Pak Qeshm Fish Powder Factory / کارخانه پودر ماهی زرین صنعت پاک قشم,Iran,x,26.71006,55.8065,Hormozgan,Qeshm
Khazar Kilka Processing Company / شرکت کیلکا فرآور خزر,Iran,"Gilan Province, Astara County, Lavandevil District, Chelvand Rural District, Ghareh Soo Village, No Neighborhood, Ghareh Soo Road, Shahid Shafiee Dead End, No.  0, Ground Floor",,,,
Marine Products of Kimia-ye Jask / فرآورده های دریائی کیمیای جاسک,Iran,"Hormozgan Province, 98, PX73+GJJ, Iran",25.71352,57.95403,Hormozgan,Bandar-e-Jask
Pesquera Bahía Caldera S.A.,Chile,"Avda. Las Industrias 1190, Caldera. Chile",-27.064498,-70.832559,"Provincia de Copiapó,
Atacama Region",Caldera
Mazandaran Animal and Aquatic Feed Company (MANAQUA),Iran,"H598+29F, Badeleh, Mazandaran Province, Iran",36.56765,53.16588,Mazandaran,Badeleh
Navid Daneh Khazar Company,Iran,"Khuzestan Province, Ahvaz, Albaji Industrial Town, Ahvaz-Shush Expy, FJF5+RVF, Iran",31.4743,48.60977,Khuzestan,Ahvaz
Nazdane Sepahan Co,Iran,"Isfahan Province، بزرگراه شهرک صنعتی جی-نرسیده به پل، فرودگاه-جاده، PW6P+GMJ کشتارگاه مرغ, Iran",32.71125,51.93658,,#REF!
Negin Feed,Iran,"C9VJ+8R Jahliyān, Sistan and Baluchestan Province, Iran",36.445,59.6578,Sistan and Baluchestan Province,Jahliyān
Partsirang,Iran,"9CW7+FG4, Konarak, Sistan and Baluchestan Province, Iran",25.3964,60.4138,Sistan and Baluchestan Province,Konarak
Podre Mahi,Iran,,,,Tehran,Tehran
Podre Mahi,Iran,,35.53822,51.61083,Tehran,Tehran
Sayadan Javan Jask,Iran,"Unit 3, Second Floor, Shams Builidng, Damahi Street, Golshahr, Bandar Abbas, Iran",27.21642,56.34511,Hormozgan,Bandar Abbas
Southern Fish Powder Company,Iran,"883H+XPQ, Bandar Abbas, Hormozgan Province, Iran",27.30497,56.32934,Hormozgan,Bandar Abbas
Tabai Fish Powder Factory (Mohammad Tabaei Fish Powder and Oil Factory),Iran,"Semnan-Tehran Road, Mian Saman District, Gach Zumard Road, Seyed Abad Industrial Town, Tabai Fish Powder and Oil Factory (Factory Address)",35.26966,52.6689,Tehran,Tehran
Pars Kilka,Iran,"Mazandaran, City: Babolsar, Mirood Industrial and Fishery District, Pars Kilka Marine Products Company",36.72523,52.77724,Mazandaran,Mirud
پودر زرین / Golden Powder / Zarrin Powder,Iran,"FHJQ+78, Moqsam, Hormozgan Province, Iran",27.47318,56.58784,,
Mahdaneh South Fish Meal,Iran,"Tehran, Shahryar, Rabat Karim Road, in front of Mehstan gas station, Yekeh, after Imamzadeh St., Thramari St., Koi Hasht Metri I (Haj Hossein), No.  1",35.56485,51.03338,Tehran,Robat-Karim
fish powder of sahil kar anzali / Fish Powder of Kar Beach Anzali,Iran,"Anzali, 10 km on the Roudasht Road, Aliabad",,,Gilan,Anzali
Sayyad Qeshm Fish Meal,Iran,Kilometer 4 of the Souza to Ramkan Road,26.81366,56.06875,Hormozgan,Qeshm
Mafan Anzali Fish Meal,Iran,"F7JJ+M2X, اشپلا, Gilan Province, Iran",37.48147,49.2809,Gilan,Maaf
Roshd Dorna,Iran,"Kerman - Khadra Industrial Town, Kerman",,,,
Baran Rize Silk Road Company / Sherkat Baran Rize Rah Abrisham,Iran,"Gilan Province, Rasht County, Central District, Rasht City, Motahari Neighborhood (Chahar Baradaran), Shahid Motahari Boulevard, Hesam Street, No.  0, Novin Complex, Third Floor.",,,,
"International Fish Meal Company Mato Fish, Shahre Aftab, and Mahakood Fish Fertilizer / Mato Fish International Fish Meal Company, Shahre Aftab, and Mahakood Fish Fertilizer / Aftab Shahr Mahkod Fish Fertilizer International Co., Ltd / Mato Qeshm Fish Meal",Iran,"P3GQ+2J, Bandar Aftab, Hormozgan Province, Iran",26.725,54.08909,Hormozgan,Bandar Aftab
Persian Chabahar Fish Meal Company,Iran,"Sistan and Baluchestan Province, Konarak، Unnamed Road، CC26+37F, Iran",25.40019,60.41047,Sistan and Baluchestan,Konarak
Golden Seed Chabahar Fish Meal Company,Iran,"Sistan and Baluchestan Province, Konarak، Unnamed Road، 9CW7+CQ6, Iran",25.39611,60.41429,Sistan and Baluchestan,Konarak
"Saba Majd Qeshm Fish Meal Cooperative Company / Qeshm Cooperative Fish Meal Company, Saba Majd",Iran,"Suzā، جزیره قشم،، Q2JM+3WX, Iran",26.78015,56.03471,Hormozgan,Qeshm
Aras Marine Products Co,Iran,"F9FQ+GR7, Bandar Anzali, Gilan Province, Iran",37.47336,49.38942,Gilan,Bandar Anzali
Kilka Powder Sahar Company / Sherkat Kilka Poodar Sahar,Iran,"Rasht, Bosar Bridge, across from Moradian Alley, Bahar Alley, No.  7.",,,,#REF!
Gulshan Asur Company,Iran,"Mazandaran Province, Mostafa Khomeini Industrial Town",36.72273,53.04712,,#REF!
Motavakesham Company,Iran,km 2 of Sousa to Remkan road,26.80635,56.07157,Hormozgan,Qeshm
Qeshm Fish Processing /Faravari Mahi Qeshm / Sherkat Faravari Mahi Qeshm,Iran,"Suzā، Unnamed Road، Q392+PWX, Iran",26.76925,56.05223,Hormozgan,Qeshm
Ghaem Seaside Powder / Qam Sahal Powder,Iran,"Bandar Anzali, 7 km on the Zibakenar Road, Beach Street",35.26962,52.66897,Gilan,Anzali
Tiyab Fish Meal Factory,Iran,"985J+GX Pozm Tiyab, Sistan and Baluchestan Province, Iran",25.35875,60.33255,,#REF!
Yazdan Darya Bostaneh Fish Meal Factory / Karkhaneh Poodar Mahi Yazdan Darya Bostaneh,Iran,"Hormozgan Province, Bandar Lengeh County, Central District, Bostaneh Village, Main Street, Kazem Mosque Alley, No.  0, Ground Floor",,,Hormozgan,Bostaneh
"Pacific Marine Food Products Co.,Ltd",Thailand,"75/12 Moo 5 Soi Wat Sopanaram, Kokkham, Muang, Samutsakorn Province 74000 Thailand",19.27484,97.951,,
"Advance Agro and Technology Part., Ltd.",Thailand,"230 m.5 Nong Phai Lom Village, Nong Bua Yai",15.51058,101.88449,Chaiyaphum,Chatturat
"Anusorn Aquatic Industry Co., Ltd.",Thailand,"1100 Wichian Chodok Rd., Mahachai, Mueang Samut Sakhon, Samut Sakhon Province",13.535905,100.262531,Samut Sakhon,Mueang Samut Sakhon
"Aquatic Deal Co., Ltd.",Thailand,"6/39 Liap Khlong Song 25 Alley, Bang Chan",13.86266,100.71629,Bangkok,Khlong Sam Wa
"Bangsaphan Union Fishmeal Co., Ltd. / Company Limited Fishmeal Bridges",Thailand,4056 Maeramphueng,11.21603,99.57135,Prachuap Khiri Khan,"Bang Saphan, Prachuap Khiri Khan"
"Densamut Fishmeal Factory Part., Ltd.",Thailand,"62/1 Tharuamai Rd., Ratsada",7.88028,98.41233,Phuket,Mueang Phuket
"K-Pro (Thailand) Co., Ltd.",Thailand,"Unit C (No. 10), Chaemchan Alley, Klongton-Nua",13.73883103,100.5873032,Bangkok,Watthana
"Khantichai Fishmeal Co.,Ltd.",Thailand,203 m.1 Bang Chakreng,13.37365,99.996,Samut Songkhram,Mueang Samut Songkhram
"Khuraburi Fishmeal Industry Co., Ltd.",Thailand,"5/1 m.10, Phetkasem Rd., Khura",9.24535,98.39798,Phang Nga,Khura Buri
"N.K. Fishmeal Co., Ltd.",Thailand,"18/134 m.8 Jamjun Alley, Kaset-Navamin Rd., Klongkum",13.640668,100.431734,Bangkok,"Buengkun, Bangkok"
